text,label_str,source,priority,label,weight
"In its financial report , published on Friday , SEB said its net profit soared to SEK6 .745 bn in 2010 from a year-earlier SEK1 .114 bn and proposed a 50 % dividend increase to SEK1 .50 per share .",positive,allagree,1,2,1.0
"Kesko offers Hilton to open a hotel on Kalinisky prospect in a 18,000-square metres building because of these difficulties .",neutral,75agree,2,1,0.7
"In April 2010 , Olvi 's range of ciders will expand with a strawberry-rhubarb and an apple-pear cider in green bottles with a new shape .",neutral,75agree,2,1,0.7
Profit of the accounting period was EUR 0.3 mn .,neutral,75agree,2,1,0.7
"The total number of shares in the company will be 585,236,987 Innofactor group Innofactor offers its customers comprehensive solutions in the Microsoft environment .",neutral,75agree,2,1,0.7
Results are expected late in 2006 .,neutral,75agree,2,1,0.7
"Finnish management software solutions provider Ixonos Oyj net profit decreased to 369,000 euro ( $ 575,000 ) for the first quarter of 2008 from 669,000 euro ( $ 1.0 mln ) for the same period of 2007 .",negative,allagree,1,0,1.0
"The broker has initiated both Palfinger AG and Konecranes OYJ with ` buy ' recommendations , with 51 and 42 eur price targets respectively .",positive,75agree,2,2,0.7
"Ragutis , which is based in Lithuania 's second-largest city Kaunas , boosted its sales last year 22.3 per cent to 36.4 million liters .",positive,allagree,1,2,1.0
The value of the deal is estimated at between SEK25m and SEK50m .,neutral,75agree,2,1,0.7
"`` UPM 's deliveries increased during the third quarter by 4 percent , and the efficiency of operations improved , '' Chief Executive Jussi Pesonen said .",positive,allagree,1,2,1.0
"The company , which has EUR2 .8 bn in assets , counts among its five largest shareholders Finnish insurers Ilmarinen 4.34 % and Varma 0.70 % , as well as the Finnish state pension fund VER 0.61 % .",neutral,allagree,1,1,1.0
"ALEXANDRIA , Va. , Nov. 19 -- Erkki Aho , Elimaki , Finland , has developed a method and apparatus in conjunction with a shoe press .",neutral,75agree,2,1,0.7
Also the development of online businesses will continue .,neutral,allagree,1,1,1.0
Finnish laboratory liquid handling and diagnostic test systems developer Biohit Oyj OMX Helsinki : BIOBV issued on Tuesday 3 June a profit warning for the financial year 2008 .,negative,allagree,1,0,1.0
"The fair value change of investment properties was EUR 15.8 mn , compared to EUR 22.9 mn in the third quarter of 2009 .",negative,75agree,2,0,0.7
"Cencorp estimates that its net sales in the last quarter will be as earlier stated , EUR4 .3 m to EUR5 .0 m , and operating profit (EBIT)is estimated to be positive .",positive,75agree,2,2,0.7
"ST. PETERSBURG , Oct 14 ( PRIME-TASS ) -- Finnish tire producer Nokian Tyres plans to invest about 50 million euros in the expansion of its tire plant in the city of Vsevolozhsk in Russia 's Leningrad Region in 2011 , the company 's President Kim Gran told reporters Thursday .",positive,75agree,2,2,0.7
"In the sinter plant , limestone and coke breeze are mixed with the iron ore concentrate and sintered into lump form or sinter for use in the blast furnaces as a raw material for iron-making .",neutral,allagree,1,1,1.0
Finnish silicon wafer technology company Okmetic Oyj OMX Helsinki : OKM1V said on Wednesday 17 September that it will invest EUR6m in its sensor wafer business during 2009 .,neutral,allagree,1,1,1.0
"Citigroup , Inc NYSE : C , Deutsche Bank NYSE : DB and Pohjola Bank are lead managers for the sale .",neutral,75agree,2,1,0.7
"However , the bottom-line result improved thanks to positive financial items .",positive,75agree,2,2,0.7
The total value of the deal is USD 29mn .,neutral,75agree,2,1,0.7
The soapstone deposits in the Medvezhyegorsk area are expected to increase Tulikivi 's current reserves considerably .,positive,allagree,1,2,1.0
"The company is now withdrawing the second part , EUR 7.2 mn , of the investment commitment .",neutral,75agree,2,1,0.7
The first of the two project phases is expected to be completed by the end of 2012 .,neutral,allagree,1,1,1.0
Sanoma Magazines Finland 's net sales grew to EUR 140.1 mn from EUR 131.8 mn .,positive,allagree,1,2,1.0
Peigs www.peigs.se will become part of Sardus Latta Maltider Light Meals unit .,neutral,allagree,1,1,1.0
"According to Finnair Technical Services , the measure is above all due to the employment situation .",neutral,allagree,1,1,1.0
"The businesses to be divested offer dairy , edible fats , ready-meal and ice-cream packaging to multinational and local customers .",neutral,allagree,1,1,1.0
A total of $ 78 million will be invested in the project .,neutral,allagree,1,1,1.0
All of Raisio 's divisions recorded an operating profit .,positive,75agree,2,2,0.7
"A maximum of 666,104 new shares can further be subscribed for by exercising B options under the 2004 stock option plan .",neutral,allagree,1,1,1.0
The EUR 0.7 million non-recurring expenses have been recorded for the third quarter .,neutral,allagree,1,1,1.0
Net sales revenue per passenger is expected to increase .,positive,allagree,1,2,1.0
The value of the order is USD 2.3 mn .,neutral,allagree,1,1,1.0
"Glaston 's own glass processing unit , Tamglass Glass Processing , is a manufacturer of high quality safety glass products , and operates in Finland .",neutral,allagree,1,1,1.0
From Merisatama to the far corners of the world Asfaltti Osakeyhti+ Lemmink+inen was established in 1910 by a group of master builders in Helsinki as a specialist business and subcontractor .,neutral,allagree,1,1,1.0
"The tightened competition situation in the production automation market has affected net sales during 2006 , Cencorp said .",negative,75agree,2,0,0.7
The share subscription period will expire on 30 September 2007 .,neutral,allagree,1,1,1.0
"( ADPnews ) - Oct 21 , 2009 - Finland-based IT consultancy Tieto Oyj ( HEL : TIE1V ) said today its net profit plunged to EUR 29.4 million ( USD 43.9 m ) for the first nine months of 2009 from EUR 58.7 million for the same period o",negative,75agree,2,0,0.7
The organization that is a member of the Russian auto sector union MPRA has become active since Tikkurila acquired Russian paint company Kraski Teks in 2006 .,neutral,75agree,2,1,0.7
These savings will have full impact as of the beginning of 2007 .,neutral,75agree,2,1,0.7
Marimekko is considering further measures in the matter .,neutral,allagree,1,1,1.0
It also said its third quarter diluted EPS came in at 0.34 eur compared with 0.16 eur in the same quarter a year ago .,positive,allagree,1,2,1.0
CORPORATE IT UPDATE - ( C ) 1995-2009 M2 COMMUNICATIONS LTD Finnish technology group Teleste Corporation ( OMX Helsinki : TLT1V ) reported on Wednesday ( 4 February ) an operating profit of EUR5 .6 m on net sales of EUR108 .7 m for the year 2008 .,neutral,75agree,2,1,0.7
Finnish consumer packaging manufacturer Huhtamaki Oyj said it swung to a net profit of 84.1 mln euro $ 105.6 mln in the first nine months of 2006 from a net loss of 2.6 mln euro $ 3.3 mln in the same period of 2005 .,positive,allagree,1,2,1.0
"Name of Applicant : Jot Automation OYName of Inventor : Mammila Tuomo , Piirainen Mika and Kellokoski MikaApplication No. : 2424-KOLNP-2008 ADate of filing of Application : 16-06-2008Publication Date : 30/01/2009",neutral,allagree,1,1,1.0
"Votorantim Celulose e Papel ( VCP ) is part of the Votorantim Group , a major Brazilian conglomerate .",neutral,allagree,1,1,1.0
"The works will include the laying of natural stone pavements and the installation of underground heating , and surface water drainage systems .",neutral,allagree,1,1,1.0
"( ADP News ) - Feb 4 , 2009 - Finnish broadband data communication systems and solutions company Teleste Oyj ( HEL : TLT1V ) said today its net profit decreased to EUR 5.5 million ( USD 7.2 m ) for 2008 from EUR 9.4 million for 200",negative,allagree,1,0,1.0
Sales have risen in other export markets .,positive,allagree,1,2,1.0
"The contract includes software licences , application maintenance and training .",neutral,allagree,1,1,1.0
"Ruukki Romania , the local arm of Finnish metal producer Ruukki , increased its capital by 900,000 euro ( $ 1.14 mln ) through cash contribution , it was reported on September 19 , 2006 .",positive,75agree,2,2,0.7
Each share is entitled to one vote .,neutral,allagree,1,1,1.0
"In sales volume , Coca-Cola 's market share has decreased by 2.2 % to 24.2 % .",negative,allagree,1,0,1.0
"Ahlstrom 's 5,800 employees serve customers via sales offices and production facilities in more than 20 countries on six continents .",neutral,75agree,2,1,0.7
"The Lithuanian beer market made up 14.41 million liters in January , a rise of 0.8 percent from the year-earlier figure , the Lithuanian Brewers ' Association reporting citing the results from its members .",positive,allagree,1,2,1.0
"Tyrv+inen is of the opinion that the airline has been repeating this for some time already , however .",neutral,allagree,1,1,1.0
"Ahlstrom 's 5,700 employees serve customers via sales offices and production facilities in more than 20 countries on six continents .",neutral,allagree,1,1,1.0
"The total investment in the Vantaa plant extension will amount to around 10 million euro , and Okmetic 's share of the investments will be worth around 2.7 million .",neutral,allagree,1,1,1.0
"Through the Nordic Exchange , OMX offers access to approximately 80 percent of the Nordic and Baltic securities market .",neutral,allagree,1,1,1.0
"BasWare 's CEO Ilkka Sihvo comments in conjunction with the Interim Report : `` As a whole , BasWare succeeded well in the second quarter of 2007 .",positive,allagree,1,2,1.0
Nordstjernan has used its option to buy another 22.4 % stake of Salcomp 's shares and votes .,neutral,allagree,1,1,1.0
"Luxembourg-registered investment fund Amber Trust II has won the final approval of Lithuania 's Competition Council to acquire 29.6 percent of Sanitas , the country 's largest pharmaceutical producer .",positive,75agree,2,2,0.7
Diluted earnings per share ( EPS ) stood at EUR 0.25 versus EUR 0.42 .,negative,allagree,1,0,1.0
"Also , a six-year historic analysis is provided for this market .",neutral,allagree,1,1,1.0
"The new company , DiaPol S.r.l. , would manufacture tools meant for glass and stone pre-processing .",neutral,allagree,1,1,1.0
"On 20 March 2006 , Stora Enso refused to comment the news in any way .",neutral,75agree,2,1,0.7
26 November 2010 - Finnish sports-equipment maker Amer Sports Oyj ( HEL : AMEAS ) said today it has obtained a EUR30m Schuldschein note loan from a pool of international investors .,neutral,75agree,2,1,0.7
"However , the company saw its net profit for the third quarter down to EUR 1.4 million from EUR 1.5 million for the corresponding period of 2009 .",negative,allagree,1,0,1.0
Finnish technology company Raute Corporation ( OMX Helsinki : RUTAV ) issued on Tuesday ( 23 September ) a profit warning for the financial year 2008 .,negative,allagree,1,0,1.0
"At the request of Finnish media company Alma Media 's newspapers , research manager Jari Kaivo-oja at the Finland Futures Research Centre at the Turku School of Economics has drawn up a future scenario for Finland 's national economy by using a model developed by the University of Denver .",neutral,allagree,1,1,1.0
( A spokesperson told WWD to expect a 50-50 mix of clothing and home decor . ),neutral,allagree,1,1,1.0
"The company is also seeking possibilities to relocate the Luumaki personnel , some 50 people , to other UPM mills .",neutral,allagree,1,1,1.0
"Glaston , headquartered in Tampere , Finland , is a growing and international glass technology company .",neutral,75agree,2,1,0.7
The negotiations will concern the plant 's department producing winded roving that employs 10 people .,neutral,allagree,1,1,1.0
"In 2008 , it generated net sales of EUR 9.3 million USD 13.1 m .",neutral,75agree,2,1,0.7
"Fiskars has a strong portfolio of international brands , which include Fiskars , Iittala , Gerber , Silva and Buster .",positive,75agree,2,2,0.7
"China Unicom , NYSE : CHU , HKSE : 0762 , and SHSE : 600050 , the second largest mobile carrier in the country .",neutral,allagree,1,1,1.0
The properties were purchased from Swedish private equity real estate firm Niam and Goldman Sachs ' Whitehall Street Real Estate Funds .,neutral,allagree,1,1,1.0
"( ADP News ) - Feb 11 , 2009 - Finnish wood products technology supplier Raute Oyj ( HEL : RUTAV ) said today its net profit decreased to EUR 4.7 million ( USD 6.1 m ) for 2008 from EUR 6.6 million for 2007 .",negative,allagree,1,0,1.0
The new activity will incur an investment of about 5 MEUR .,neutral,75agree,2,1,0.7
Honkarakenne Oyj - a world-leading manufacturer of genuine wooden homes - will be sponsoring Finnish crosscountry skier Virpi Kuitunen for the next three years .,neutral,75agree,2,1,0.7
"The change in holdings in accordance with Chapter 2 , Section 9 of the Finnish Securities Markets Act is described below .",neutral,allagree,1,1,1.0
"Both operating profit and net sales for the six-month period increased , respectively , from EUR13 .8 m and EUR143 .6 m , as compared to the corresponding period in 2007 .",positive,allagree,1,2,1.0
The terms and conditions of the Stock Option Scheme 2008 are available on the Company 's internet pages www.sanoma.com .,neutral,allagree,1,1,1.0
The platform would continue to be the development framework for Symbian and MeeGo .,neutral,allagree,1,1,1.0
"` This is a repeat order to follow successfully installed 159 elevators in the same Delhi metro system , ' Kone spokeswoman told Thomson Financial News .",positive,75agree,2,2,0.7
"In the building and home improvement trade , sales decreased by 22.5 % to EUR 201.4 mn .",negative,allagree,1,0,1.0
"On 25 August 2009 , Sampo 's stake in Nordea was 19.45 % .",neutral,allagree,1,1,1.0
"The sale , which will result in a gain of some EUR 60 million in the second quarter of 2010 for Oriola-KD , supports the Finnish company 's strategy to focus on pharmaceutical wholesale and retail operations .",positive,allagree,1,2,1.0
`` Directors and shareholders alike should ask why these practices were allowed to continue . '',neutral,allagree,1,1,1.0
"`` We 're delighted with the move '' says Morna Cowie , co-owner , above , `` it 's double the size of our current shop and has a lovely feel to it . ''",positive,allagree,1,2,1.0
"In Finland , OP-Pohjola 's staff union is boycotting the group 's insurance sales tasks because the company has refused to take the sale of insurance into account in determining wages .",negative,75agree,2,0,0.7
A memorandum of understanding on cooperation between the Finnish Global Chemical Company KEMIRA and Vietnam National Chemicals Group ( Vinachem ) was signed on this occasion .,positive,75agree,2,2,0.7
"Operating profit was EUR 24.5 mn , up from EUR 23.0 mn .",positive,allagree,1,2,1.0
"Operating profit for the nine-month period decreased from EUR19 .9 m while net sales increased from EUR155 .7 m , as compared to the corresponding period in 2007 .",negative,75agree,2,0,0.7
"GUANGDONG , October 26 , SinoCast -- Nokia Telecommunications Dongguan branch entered into a letter of intent to open a Nokia Class in Qingyuan Polytechnic , Qingyuan City of Guangdong Province .",neutral,75agree,2,1,0.7
Estimations indicate that even up to 170 different tablet computers or reading devices will be available in 2011 .,neutral,75agree,2,1,0.7
Kesko has previously published a stock exchange release concerning the deal on 7 February 2007 .,neutral,allagree,1,1,1.0
"Country : , Switzerland Sector : Pharmaceuticals Target : Synosia Therapeutics Holding AG Buyer : Biotie Therapies Corp Deal size in USD : 129.4 m Type : Corporate acquisition Financing : All-stock Status : Closed",neutral,allagree,1,1,1.0
"CapMan Plc Press Release 31 March 2008 Jukka Ruuska , President of the OMX Nordic Exchanges and the Stockholm Stock Exchange , will transfer to CapMan effective no later than September 2008 .",neutral,allagree,1,1,1.0
"Earnings per share ( EPS ) in the first half of 2007 amounted to EUR0 .29 , down from EUR0 .40 year ago .",negative,allagree,1,0,1.0
The deal will have no significant effect on the acquiring company 's equity ratio .,neutral,allagree,1,1,1.0
"M-real Corporation Stock Exchange Release 27 August 2009 at 3.15 pm M-real has received the EUR 190 million cash payment from Sappi M-real Corporation , a part of Mets+liitto Group , divested its Graphic Papers business to Sappi Limited at the end of 2008 for EUR 750 million .",neutral,75agree,2,1,0.7
"After non-recurring items of EUR 177mn , profit amounted to EUR 20mn .",neutral,allagree,1,1,1.0
` Nordic infrastructure construction is one of our strategic growth areas .,neutral,allagree,1,1,1.0
"It is Estonia 's second-largest meat processing company by market share ( according to AC Nielsen 's 2008 data , 13 percent ) .",neutral,75agree,2,1,0.7
"Jan. 6 -- Ford is struggling in the face of slowing truck and SUV sales and a surfeit of up-to-date , gotta-have cars .",negative,allagree,1,0,1.0
"The government started the sell-off last month , putting an 8 percent stake in TeliaSonera on the auction bloc .",neutral,75agree,2,1,0.7
"Operating loss totalled EUR 3.2 mn , compared to a profit of EUR 7.2 mn in the third quarter of 2008 .",negative,75agree,2,0,0.7
The new factory working model and reorganisations would decrease Nokian Tyres ' costs in the factory by EUR 30 million ( USD 38.7 m ) .,positive,allagree,1,2,1.0
Managing Director Kari Inkinen says that Sponda 's leasing operations developed highly favourably .,positive,75agree,2,2,0.7
"Ethanol would be made from barley , and production could start in 2008 .",neutral,allagree,1,1,1.0
Export accounts for about one tenth of the company 's annual turnover of one billion kroons .,neutral,75agree,2,1,0.7
"We are very pleased with the fine co-operation between the two countries in recent times , he said .",positive,75agree,2,2,0.7
"Companies evaluated in the report include Aladdin , CA , F-Secure , Kaspersky , Marshal , McAfee , Microsoft , Panda , Proofpoint , Sophos , Symantec , Trend Micro , Tumbleweed , and Websense .",neutral,allagree,1,1,1.0
F-Secure Online Backup automatically protects all the content stored on a computer or smartphone by making a copy of the content to an online location .,neutral,75agree,2,1,0.7
The volumes are expected to increase during the next few years .,positive,75agree,2,2,0.7
FCC Chairman Kevin Martin said that fair play required extending the same deregulatory rules to the digital subscriber lines that telecom providers use for broadband networks .,neutral,75agree,2,1,0.7
Radiation and today is a full service house expert in radiation and nuclear safety issues .,neutral,75agree,2,1,0.7
"In today s business , you have to pre-empt what consumers want , said Mohammed Zainalabedin , General Manager , Zain Bahrain .",neutral,allagree,1,1,1.0
"The item included restructuring costs of EUR1 .6 m , while a year earlier they were EUR13 .1 m. Diluted EPS stood at EUR0 .3 versus a loss per share of EUR 0.1 .",positive,75agree,2,2,0.7
"This new deal has strengthened the partnership from Telemig Celular and Tecnomen , which it has started since the beginning of Telemig 's prepaid operations .",positive,75agree,2,2,0.7
"The Annual Report contains the financial statements , the consolidated financial statements , the report by the Board of Directors and the auditor 's report .",neutral,allagree,1,1,1.0
"Meanwhile , Electrowatt-Ekono Philippines , Inc. was also awarded a three-year operation and maintenance ( O&M ) contract by FR Cement Corporation .",positive,75agree,2,2,0.7
Protalix has $ 42 million in cash and no sales .,neutral,75agree,2,1,0.7
It was decided that the auditors are reimbursed according to invoice .,neutral,allagree,1,1,1.0
"SSH Communications Security Corporation is headquartered in Helsinki , Finland .",neutral,allagree,1,1,1.0
Olli-Pekka Kallasvuo was elected as vice chairman of the Board .,neutral,75agree,2,1,0.7
"Finnish Suominen Corporation that makes wipes , nonwovens , and flexible packaging , expects changes in the market situation to reduce sales of Suominen 's nonwovens and wet wipes from the previously estimated volumes .",negative,allagree,1,0,1.0
"In 2009 , Comptel slipped to a net loss of EUR2 .1 m from a profit of EUR6 .6 m in the previous year .",negative,allagree,1,0,1.0
The company reports a loss for the period of EUR 0.4 mn compared to a loss of EUR 1.9 mn in the corresponding period in 2005 .,positive,allagree,1,2,1.0
"Argentine agricultural export company Calafate has tapped compatriot firm Finnegans for a software solution , the latter company said in a statement .",neutral,75agree,2,1,0.7
"The mill 's raw material need will increase by 100,000 m3 of wood .",neutral,allagree,1,1,1.0
"In contrast , the company 's net loss for the third quarter of 2009 contracted to EUR 76 million from EUR 256 million for the corresponding period a year ago .",positive,75agree,2,2,0.7
Operating profit totaled EUR 17.7 mn compared to EUR 17.6 mn in the corresponding period in 2007 .,positive,allagree,1,2,1.0
The Group 's revenue in 2009 amounted to EUR 70 million and the company currently employs approximately 780 people .,neutral,75agree,2,1,0.7
"We also strengthen our existing partnership with Cybercom '' , says Teleste CTO Esko Myllyla .",positive,75agree,2,2,0.7
Amanda said that it had already made a USD5 .0 m investment commitment in Russia Partners II fund in July 2005 .,neutral,allagree,1,1,1.0
Finnish OKO bank has signed a cooperation agreement with Raiffeisen concerning Finnish companies ' investments in Russia .,positive,allagree,1,2,1.0
"HELSINKI ( AFX ) - Nokian Tyres reported a fourth quarter pretax profit of 61.5 mln eur , up from 48.6 mln on the back of strong sales .",positive,allagree,1,2,1.0
"The Group , with net sales of EUR 235 million in 2009 , employs more than 2 000 people in 33 countries .",neutral,75agree,2,1,0.7
"In Finland , the launch of tie-in sales of 3G mobile phones did not cause a dramatic rush in mobile retail outlets during the first few days .",neutral,75agree,2,1,0.7
"Net interest income totaled EUR 15.9 mn , compared to EUR 15.6 mn a year earlier .",positive,allagree,1,2,1.0
"The markets are almost completely controlled by three banks : Nordea , OP Bank Group , and Sampo .",neutral,75agree,2,1,0.7
"Finnish newspaper publisher Sanoma , of media group SanomaWSOY , is merging its free sheets Uutislehti 100 and Metro as of mid-September 2008 to form a new free sheet to be named Metro .",neutral,75agree,2,1,0.7
"The casing comprises a first side casing member provided with the first side vat segment and a second side casing member provided with the second side vat segment , at least the first side casing member being pivotable about a rotation axis .",neutral,allagree,1,1,1.0
"In addition to the presentations held by President & CEO Kai Telanne and CFO Tuomas Itkonen , participants will have an opportunity to discuss with other members of the company 's management .",neutral,75agree,2,1,0.7
The shares subscribed will be eligible for trade on the following day from the registration .,neutral,75agree,2,1,0.7
"The contracts of the employees , 96 of whom are blue-collar workers , will be ended between March and August 2011 .",negative,75agree,2,0,0.7
"After buying Eukor Car Carriers 50 percent stake , Grimaldi Group is now the sole owner of the Swedish roll-on , roll-off port of Wallhamn .",neutral,75agree,2,1,0.7
All reproduction for further distribution is prohibited .,neutral,75agree,2,1,0.7
Gunneflo will be responsible of Oriola-KD 's Pharmaceutical Trade business in Sweden .,neutral,75agree,2,1,0.7
It will report full-year results on August 22 .,neutral,allagree,1,1,1.0
Rautaruukki Corporation Stock exchange release 3 December 2009 at 12 noon Ruukki 's construction and engineering divisions are to further improve and adjust their operations in Finland .,positive,75agree,2,2,0.7
The Group also has a strong global position in other fishing categories .,positive,allagree,1,2,1.0
"The total value of the project is about EUR53m , including the plots that will be transferred to Atria .",neutral,75agree,2,1,0.7
"Previously , Grimaldi held a 46.43 pct stake in the Finnish company following the takeover bid launched in November 2006 .",neutral,allagree,1,1,1.0
"The total value of the order , placed by Aspo ' marine transportation subsidiary ESL Shipping Oy , is EUR 60 million ( USD 77.5 m ) .",neutral,75agree,2,1,0.7
The share subscription period for C options will commence on 1 September 2008 and expire on 31 March 2011 .,neutral,allagree,1,1,1.0
"The new office , located in Shenzhen , will strengthen Vaisala 's already 10-year old presence in China .",positive,75agree,2,2,0.7
The representative body of Swedish Meats approved an improved offer from Finnish HK Ruokatalo to acquire the company .,positive,75agree,2,2,0.7
"Incap Corporation Stock Exchange Announcement 29 April 2010 at 1 p.m. INVITATION TO A NEWS CONFERENCE ON INCAP 'S INTERIM REPORT Q1-2010 Incap will publish its interim report for January-March 2010 on Wednesday , 5 May 2010 .",neutral,allagree,1,1,1.0
Operating profit excluding restructuring costs grew to EUR 44.5 million from EUR 31.7 million while operating profit including restructuring costs showed even larger growth to EUR 38.5 million from EUR 7.4 million .,positive,allagree,1,2,1.0
Amanda Capital has investments in 22 private equity funds and in over 200 unquoted companies mainly in Europe .,neutral,allagree,1,1,1.0
"The total number of voting rights is 74,612,523 .",neutral,allagree,1,1,1.0
The shipyard hopes the regional government in Andalusia can offer its some form of financial support .,neutral,75agree,2,1,0.7
Danske Bank is Denmark 's largest bank with 3.5 million customers .,neutral,allagree,1,1,1.0
