text,label_str,source,priority,label,weight
Revenue grew 1 percent to euro742 .2 million US$ 964 million from euro735 million .,positive,allagree,1,2,1.0
"The 3C Expo is a signature show in Dongguan , which is supported by the Dongguan Municipal Government every year , featuring computer accessories , software , communication and network products .",neutral,allagree,1,1,1.0
Choose from a Giant Countdown with red head or rainbow trout -- or the Giant Shad Rap in perch color .,neutral,allagree,1,1,1.0
Operating profit excluding non-recurring items was EUR 7.8 million compared to EUR 11.2 million .,negative,allagree,1,0,1.0
"Net sales totaled EUR 93.6 mn , up from EUR 93.2 mn in the corresponding period in 2005 .",positive,allagree,1,2,1.0
The company then said it will focus its resources on clinical research .,neutral,allagree,1,1,1.0
The value of the order is USD 2.2 mn .,neutral,allagree,1,1,1.0
More staff has been recruited in Japan to further complement its network of close to 50 service locations in more than 20 countries worldwide .,positive,75agree,2,2,0.7
The orders also include a few high-power drives for the control of seismic compressors .,neutral,allagree,1,1,1.0
Basware Einvoices Oy will be merged into the parent company during the present fiscal period .,neutral,75agree,2,1,0.7
"Profit for the period was EUR 10.9 mn , down from EUR 14.3 mn in 2009 .",negative,allagree,1,0,1.0
"ALEXANDRIA , Va. , Oct. 15 -- Aaron Moss of Hampshire , Great Britain , has developed an ornamental design for a handset , the U.S. Patent & Trademark Office announced .",neutral,75agree,2,1,0.7
"The Finnish supplier of BSS-OSS and VAS for telecom operators , Tecnotree , has received expansion orders worth a total US$ 7.3 mn for its convergent charging and next generation messaging solutions in Latin America , the company announced without specifying which operators had placed the orders .",positive,75agree,2,2,0.7
The customer is local company Etera Mutual Pension Insurance Co and the principal tenant of the unit will be media company Alma Media Corp HEL : ALN1V .,neutral,allagree,1,1,1.0
The facility consists of a seven year bullet term loan of 200 mln euro $ 292.4 mln and a 150 mln euro $ 219.3 mln five year revolving credit facility .,neutral,75agree,2,1,0.7
Currency conversions are based on exchange rates at the time of the deal .,neutral,allagree,1,1,1.0
"The important thing now is to keep the bank 's existing 15,000 customers .",neutral,75agree,2,1,0.7
"Elcoteq 's Electronics Manufacturing Services ( EMS ) Business Segment serves customers globally in Engineering , Manufacturing and Fulfillment services .",neutral,allagree,1,1,1.0
Total operating revenue grew by 27.6 % year-on-year to EUR61m .,positive,allagree,1,2,1.0
"The Board of Directors proposes to the Shareholders ' Meeting on 18 March 2010 that the company would pay dividend for the financial year January 1 - December 31 , 2009 , EUR 0.02 per share .",neutral,75agree,2,1,0.7
Our superior customer centricity and expertise in digital services set us apart from our competitors .,positive,75agree,2,2,0.7
"Rinkuskiai raised the sales by 18.1 percent , to 1.37 million liters , while the sales of Kauno Alus grew by 14.3 percent , to 960,000 liters .",positive,75agree,2,2,0.7
"The company said that the operations will be sold to a newly established company , CPS GmbH , where the present management of the plastics business is a co-owner .",neutral,allagree,1,1,1.0
The acquisition of +landsbanken Sverige in 2009 burdened the performance with EUR 3.0 mn .,negative,75agree,2,0,0.7
"In 2009 , KONE had annual net sales of EUR 4.7 billion and approximately 34,000 employees .",neutral,75agree,2,1,0.7
"- Demand for fireplace products was lower than expected , especially in Germany .",negative,allagree,1,0,1.0
"Based on negotiations with personnel , some 20 % have indicated their willingness to move to the new location .",neutral,75agree,2,1,0.7
HK Ruokatalo 's target is to know the consumers .,neutral,allagree,1,1,1.0
"Operating profit was EUR -0.1 mn , down from EUR 1.3 mn .",negative,allagree,1,0,1.0
The purchase sum is about EUR 10mn US$ 12.97 mn .,neutral,allagree,1,1,1.0
"Rockwell Collins is a provider of flight deck , cabin and information management solutions for business aircraft operators .",neutral,allagree,1,1,1.0
"The second company acquired is Sweden 's Reftele Maskinservice AB , whose business is mainly field services and spare parts manufacturing , with 10 employees and 1.2 mln eur sales a year .",neutral,75agree,2,1,0.7
"Nokia OYJ 's production site at Bochum , Germany , posted profit before interest of 134 mln eur for 2007 , Capital reported in an excerpt of an article to be released tomorrow , citing internal documents .",neutral,75agree,2,1,0.7
KONE is listed on the Nordic Exchange in Helsinki .,neutral,allagree,1,1,1.0
"Erkki Jarvinen , President of Rautakirja and the head of the Sanoma Trade division , will leave his current tasks in spring 2009 for a similar position outside the Sanoma Group .",neutral,allagree,1,1,1.0
Technical indicators for the stock are bullish and S&P gives NOK a positive 4 STARS out of 5 buy ranking .,positive,allagree,1,2,1.0
"The value of the deal exceeds EUR500 ,000 , the company said .",neutral,75agree,2,1,0.7
Operating profit for the quarter April-June 2006 amounted to EUR42 .9 m on net sales of EUR156 .3 m.,neutral,75agree,2,1,0.7
"The world of glass is coming to Egypt and we invite Visitors from all around the world to attend Glass World Exhibition 2009 , Register Now at www.glassworldex.com",neutral,75agree,2,1,0.7
The divested stake represented about 2.7 m shares in Okmetic 's capital .,neutral,allagree,1,1,1.0
The proposal of the shareholders to elect Mr. Hannu Krogerus to the Board is based on his long and unrivalled experience and knowledge of all matters related to Elcoteq .,neutral,allagree,1,1,1.0
"The power supplies , DC power systems and inverters designed and manufactured by Efore , and systems incorporating them are used in many different applications .",neutral,allagree,1,1,1.0
"At the end of the review period , Nordic Aluminium 's order book stood at EUR 8.77 mn compared to EUR 7.04 in 2005 .",positive,allagree,1,2,1.0
"EBIT totalled EUR 14.4 mn , compared to a loss of EUR 0.3 mn in the corresponding period in 2009 .",positive,allagree,1,2,1.0
"H+kan Dahlstr+m , head of mobility services at TeliaSonera , has forecast that mobile data volume on the TeliaSonera network in Sweden will rise eight-fold to 200,000 TB by 2014 .",positive,allagree,1,2,1.0
"Mobile phone shipments jumped 26 percent to almost 112 million units , while Finnish company 's global market share rose to 39 percent from 36 percent .",positive,75agree,2,2,0.7
"The group intends to relocate warehouse and office space in Loudeac and Saint Marcel to Morvillars , in the east of the country , where it already operates a hook manufacturing and distribution unit .",neutral,allagree,1,1,1.0
"In 2006 the company 's net sales amounted to approximately EUR259m and it has some 8,000 employees .",neutral,75agree,2,1,0.7
"The offer price is $ 35 million , including cash of $ 10 million as net debt assumption of FACE , and $ 20 million worth of Cencorp shares to be issued to Savcor .",neutral,allagree,1,1,1.0
Almost the entire office building will be occupied by Metso .,neutral,allagree,1,1,1.0
Residents access to the block is planned to be from Aleksandri Street .,neutral,allagree,1,1,1.0
"`` The second quarter of 2010 was the firstquarter with growth in net sales since the third quarter of2008 , '' said Magnus Rosen , Ramirent CEO .",positive,75agree,2,2,0.7
Finnish business software group AffectoGenimap Oyj said its net profit halved to 1.2 mln euro ( $ 1.5 mln ) in the first nine months of 2006 from 2.2 mln euro ( $ 2.8 mln ) in the same period of 2005 .,negative,allagree,1,0,1.0
"Meanwhile , Nokia said that it will be able to deliver a complete range of services from deployment operations to consulting and integration to managed services as a result of the buyout .",positive,75agree,2,2,0.7
The EA Reng group posted sales of approximately 84 million kroons for 2007 .,neutral,allagree,1,1,1.0
The acquisition price was not disclosed .,neutral,allagree,1,1,1.0
"As much biomass will be used as can be sourced locally , with the rest of the plant 's fuel needs met by peat .",neutral,allagree,1,1,1.0
"Finland-based Elcoteq SE , a privately held provider of electronics manufacturing services to communications companies , said Thursday it signed a long-term manufacturing supply deal with communications equipment company Andrew Corp. .",positive,allagree,1,2,1.0
"The share sale , to foreign and Finnish investors , is expected to raise some euro300 million ( US$ 380 million ) .",neutral,75agree,2,1,0.7
"Adanac Molybdenum of Canada has ordered grinding technology for its molybdenum project in British Columbia , Canada , while Shalkiya Zinc of Kazakhstan has awarded a contract for grinding technology for the Shalkiya zinc-lead project in Kazakhstan .",positive,75agree,2,2,0.7
Acquisitions have been made and businesses have been well integrated .,positive,75agree,2,2,0.7
"Altogether CapMan employs approximately 150 people in Helsinki , Stockholm , Copenhagen , Oslo , Moscow and Luxembourg .",neutral,allagree,1,1,1.0
"Upon establishment , the plan is directed to approximately 20 persons .",neutral,allagree,1,1,1.0
Finnish investment group Norvestia Oyj said its net profit fell to 23.5 mln euro $ 30.6 mln in 2006 from 33.5 mln euro $ 43.6 mln in 2005 .,negative,allagree,1,0,1.0
Operating profit improved by 16.7 % to EUR 7.7 mn .,positive,allagree,1,2,1.0
"The period-end cash and cash equivalents totaled EUR6 .5 m , compared to EUR10 .5 m in the previous year .",negative,75agree,2,0,0.7
"`` We are very pleased to be working with Fujitsu and NTT DoCoMo to advance the progress of LTE , '' said Juergen Walter , Head of Converged Core , Nokia Siemens Networks .",positive,75agree,2,2,0.7
"France T+l+com spent more time studying TeliaSonera than other potential takeover targets because it has a shareholder that wants to sell , Pellissier said .",neutral,allagree,1,1,1.0
"ALEXANDRIA , Va. , March 20 -- Patrik Flykt and Timo Alakoski , both of Helsinki , Finland , and Tapio Suihko and Nadarajah Asokan , both of Espoo , Finland , have developed a method of mobility support of Internet-type protocol traffic in a communication system .",neutral,75agree,2,1,0.7
"The payment of 2.779 million litas in interest on a long-term loan provided by Ragutis ' majority shareholder , Estonia 's A. Le Coq , also added to the losses .",negative,75agree,2,0,0.7
"Digia said its consolidated net sales for January-June 2010 were EUR67 .8 m , up 9.7 % on the same period in 2009 ( EUR61 .9 m ) .",positive,allagree,1,2,1.0
Why put up costly cell phone towers in thinly populated areas when a few balloons would do ?,neutral,75agree,2,1,0.7
Operating profit fell to EUR 38.1 mn from EUR 55.3 mn in 2007 .,negative,allagree,1,0,1.0
"The operations to be sold include manufacturing units in Finland , France , Poland and Turkey , as well as sales units in Germany and Lithuania .",neutral,allagree,1,1,1.0
"---------------------------------------------------------------------- -------------- Munich , 14 January 2008 : BAVARIA Industriekapital AG closed the acquisition of Elcoteq Communications Technology GmbH in Offenburg , Germany , with the approval of the",neutral,75agree,2,1,0.7
"NAVTEQ has a commanding lead in installed map data systems in North American vehicles and may be the leader in turn-by-turn navigation data offered by services such as OnStar in North America , said analyst Phil Magney of Telematics Research Group in Minnetonka , Minn. .",positive,75agree,2,2,0.7
"Outotec , headquartered in Espoo , Finland , is a leading provider of process solutions , technologies and services for the mining and metallurgical industries .",neutral,75agree,2,1,0.7
Profit for the period fell to EUR 1.6 mn from EUR 7.5 mn in January-September 2008 .,negative,75agree,2,0,0.7
The volume of investments in the two phases of the project is estimated at USD 300mn ( EUR 215.03 mn ) .,neutral,allagree,1,1,1.0
`` Consumers have very well received our packed fresh meat .,positive,75agree,2,2,0.7
"Viking Line 's cargo revenue increased by 5.4 % to EUR 21.46 mn , and cargo volume increased by 2.4 % to 70,116 cargo units .",positive,allagree,1,2,1.0
"He does not believe , however , that HKScan or Atria will start to use imported meat as Finnish consumers prefer domestic products .",neutral,75agree,2,1,0.7
"The Finnish company sold its UK operation - consisting of 50 staff in offices in London , Birmingham and Manchester - as part of a deal with Hampden in July 2001 for its European-wide property and casualty arm Sampo Industrial .",neutral,75agree,2,1,0.7
The event can be followed on-line via Orion 's Finnish homepage at www.orion.fi as well as via the Kauppalehti Live web service at www.kauppalehti.fi/live .,neutral,allagree,1,1,1.0
"GS Engineering will install the valves at a liquefied natural gas LNG plant it has built for UAE LNG extraction and gas plants operator GASCO in Ruwais , UAE .",neutral,75agree,2,1,0.7
"The pilot project proved that RIFD technology is ideal for our purposes '' , comments Olli Saarinen , Material Handling Supervisor at Yara .",positive,75agree,2,2,0.7
"Tecnotree 's convergent charging solution includes functionality for prepaid and post-paid billing , charging and rating of voice calls , video calls and raw data traffic for both mobile and fixed networks .",neutral,allagree,1,1,1.0
This solution is an extension to the existing online mediation solution delivered earlier by Comptel and IBM .,neutral,75agree,2,1,0.7
Net sales decreased to EUR 220.5 mn from EUR 470.0 mn in the corresponding period in 2009 .,negative,allagree,1,0,1.0
Finnish energy company Fortum has set itself new stricter target limits for short-term carbon dioxide emissions from its heat and electricity production .,neutral,75agree,2,1,0.7
"Svyturys-Utenos Alus , which is controlled by the Nordic group Baltic Beverages Holding ( BBH ) , posted a 6.1 percent growth in beer sales for January-September to 101.99 million liters .",positive,allagree,1,2,1.0
"`` If you need malware removal tools , type the URL of your vendor of choice directly into the browser bar and use links on their website , '' wrote Trend Micro 's Rik Ferguson on Monday .",neutral,allagree,1,1,1.0
Stock Exchange Release 10/3/2011 12:00 Sanoma has published its Annual Report and Financial Statements for 2010 and its first Corporate Responsibility Report .,neutral,allagree,1,1,1.0
"Neste Oil Corp. has signed long-term procurement contracts with Honkajoki Oy and Findest Protein Oy , both owned by Finnish food manufacturers , for the supply of animal fat for biodiesel production at Neste 's 200,000 b-cd Porvoo , Finland , refinery .",positive,75agree,2,2,0.7
J+rvi-Suomen Portti is also planning to reduce the use of sodium nitrite .,neutral,75agree,2,1,0.7
"These new units will be built at Cargotec 's state of the art manufacturing facility in San Antonio , Texas , USA , which started operations in 2009 .",neutral,allagree,1,1,1.0
"F-Secure , a developer of security solutions as a service through Internet Service Providers and mobile operators , announced results from its annual Online Wellbeing Survey .",neutral,allagree,1,1,1.0
"The company is in the process of building a new fleet and has placed orders for 10 P-Max tankers of 65,200 dwt .",positive,75agree,2,2,0.7
Also Lemmink+inen 's profit for accounting period went up to EUR 3.1 mn from EUR -24.5 mn a year ago .,positive,75agree,2,2,0.7
Finnish automation solutions developer Cencorp Corporation ( OMX Helsinki : CNC1V ) issued on Thursday ( 18 September ) a profit warning for the third quarter of 2008 .,negative,allagree,1,0,1.0
Production at the plant will be based on Neste Oil 's proprietary technology that can use a flexible input of any vegetable oil or animal fat .,neutral,75agree,2,1,0.7
The insurance division turned a EUR120m profit .,neutral,75agree,2,1,0.7
The company had hoped the new plant would be on stream by the end of 2008 .,neutral,75agree,2,1,0.7
Sunrise Resources operates in Russian near-shore development markets through its wholly-owned Russian subsidiary and has 80 % of its personnel in Russia .,neutral,allagree,1,1,1.0
ASSA ABLOY Kaupthing Bank gave a ` neutral ' recommendation and a share price target of 174 crowns $ 24.7 - 19 euro on Swedish lock maker Assa Abloy AB .,neutral,allagree,1,1,1.0
Finnish Cargotec has been awarded a significant order for a total of 292 Hiab loader cranes by BAE Systems in the US .,positive,75agree,2,2,0.7
Teleste BK Optiflex amplifier products will be used in ongoing capacity upgrade of KDG 's network to bi-directionality .,neutral,75agree,2,1,0.7
Finnish fibers and plastics producer Suominen Corporation OMX Helsinki : SUY1V reported on Wednesday 22 October an operating loss of EUR0 .8 m on net sales of EUR55 .2 m for the third quarter of 2008 .,neutral,75agree,2,1,0.7
The Remote Radio head module will be available at 4W power for 2.5 GHz and 3.5 GHz TDD frequency bands .,neutral,75agree,2,1,0.7
Finnish fibers and plastic products maker Suominen Corporation said its net loss from continuing operations narrowed to 1.8 mln euro ( $ 2.3 mln ) in 2006 from 3.7 mln euro ( $ 4.8 mln ) in 2005 .,positive,75agree,2,2,0.7
"Vanhanen said the strike would be `` extremely damaging '' as some 1,300 participants and reporters begin to arrive in Finland for the one-day EU summit with Russian President Vladimir Putin in Lahti , about 100 kilometers ( 60 miles ) north of Helsinki .",negative,75agree,2,0,0.7
Scanfil expects net sales in 2008 to remain at the 2007 level .,neutral,75agree,2,1,0.7
"The inaugural speech will be given by Hannu Kyrolainen , Finland 's Ambassador to the Czech Republic .",neutral,allagree,1,1,1.0
"Profit for the period totaled EUR 39.4 mn , up from EUR 33.9 mn in the corresponding period in 2006 .",positive,allagree,1,2,1.0
The employee negotiations are to address measures needed to adjust the operations to the present production situation .,neutral,allagree,1,1,1.0
"The inventors are Mukkavilli Krishna Kiran , Sabharwal Ashutosh and Aazhang Behnaam .",neutral,allagree,1,1,1.0
"By combining its existing solutions into a single platform , Comptel said that it has reduced the cost of deployment .",positive,75agree,2,2,0.7
"The mill will have capacity to produce 500,000 tonnes of pulp per year .",neutral,allagree,1,1,1.0
"M-real , which is part of Finnish paper maker Metsaliitto Group , is due to release its second-quarter report at around 12:00 EET on 5 August 2010 .",neutral,allagree,1,1,1.0
Deliveries will start in the second half of 2007 and the start-up of the mill is scheduled for 2008 .,neutral,75agree,2,1,0.7
The company also said that it will sell approximately 150 hectares of land to the city of Valkeakoski by the end of the year a part of its `` From job to job '' program .,neutral,75agree,2,1,0.7
The writing and publication of Lemmink+inen - s history is a continuation of earlier collaboration between Antti Tuuri and the company .,neutral,allagree,1,1,1.0
"In the video above Marimekko 's design manager , Noora Niiininoski , explains that the brands are a natural fit for each other because they both have a timeless style .",neutral,75agree,2,1,0.7
Cramo slipped to a pretax loss of EUR 6.7 million from a pretax profit of EUR 58.9 million .,negative,allagree,1,0,1.0
"It would be premature to talk about dates , volume and the investment procedure , '' he said .",neutral,75agree,2,1,0.7
The use case dramatically narrows if you go only with the hot s Ltd.,neutral,75agree,2,1,0.7
"3 January 2011 - Scandinavian lenders Sampo Bank ( HEL : SAMAS ) , Pohjola Bank ( HEL : POH1S ) and Svenska Handelsbanken ( STO : SHB A ) have provided a EUR160m ( USD213m ) line of credit to Lemminkainen Oyj ( HEL : LEM1S ) , the Finnish construction firm said on Friday .",neutral,allagree,1,1,1.0
"In Sweden , operating profit for the period under review totaled EUR 3.4 mn , up 30.8 % from the corresponding period in 2005 .",positive,allagree,1,2,1.0
All are welcome .,neutral,75agree,2,1,0.7
It posted a turnover of 4.5 mln euro $ 6.1 mln and an operating profit of 1.5 mln euro $ 2.0 mln for 2006 .,neutral,allagree,1,1,1.0
The Swedish subsidiary holds 1.0 % net smelter return `` NSR '' royalties over two advanced copper projects in northern Sweden - the Viscaria and Adak Projects - being developed by Avalon Minerals Ltd. ASX : AVI .,neutral,allagree,1,1,1.0
"Basware Corporation stock exchange release August 31 , 2010 at 16:25 Basware signed a large deal with an international industrial group Basware will deliver Invoice Automation solution and Connectivity Services to an international industrial group .",positive,allagree,1,2,1.0
The value of the deal was not disclosed .,neutral,allagree,1,1,1.0
"`` We are delighted to welcome Elisa to our Board of Directors , '' said Garry McGuire , CEO of RMG Networks .",positive,75agree,2,2,0.7
"Based upon its unique fiber expertise and innovative approach , the company has a strong market position in several business areas in which it operates .",positive,75agree,2,2,0.7
`` Demand for sports equipment was good in 2005 .,positive,allagree,1,2,1.0
"Commenting on the deal , Shane Lennon , SVP of Marketing & Product Development at GyPSii said : ?",neutral,allagree,1,1,1.0
The Group 's cash flow from operations will be positive .,positive,75agree,2,2,0.7
NORDIC BUSINESS REPORT-26 June 2006-Metso Corporation wins EUR50m equipment order in Australia - 1998-2006 M2 COMMUNICATIONS LTD The Finnish engineering and technology group Metso Corporation said on Monday ( 26 June ) that it has received a EUR50m equipment order in Australia .,positive,75agree,2,2,0.7
"In 2007 , Etteplan had turnover of EUR125 .2 m.",neutral,allagree,1,1,1.0
Operating profit decreased to EUR 16mn from EUR 21.1 mn in 2008 .,negative,75agree,2,0,0.7
It will focus on improving its profitability next year by streamlining operations .,positive,75agree,2,2,0.7
"29 September , 2010 Finnish waste management and recycling company Lassila & Tikanoja expands its operations in Russia by introducing its recently completed recycling plant in the city of Dubna near Moscow .",positive,allagree,1,2,1.0
Finnish metal products company Componenta Oyj net profit went slightly down to 25.1 mln euro ( $ 40.2 mln ) for the first half of 2008 from 25.4 mln euro ( $ 40.7 mln ) for the same period of 2007 .,negative,allagree,1,0,1.0
"In 2008 , AVC Systemhaus had net sales of EUR 10 million USD 7.1 m .",neutral,allagree,1,1,1.0
The company admits that 36 months is a relatively short time when operating in Russia .,neutral,75agree,2,1,0.7
The company continued the development of a fully human antibody in its VAP-1 antibody program .,neutral,allagree,1,1,1.0
The value of the orders is about EUR 25mn .,neutral,allagree,1,1,1.0
HELSINKI AFX - Outokumpu said its technology unit has won a 28 mln eur contract from Bosnia-Herzegovina 's Aluminij dd Mostar to upgrade an anode plant .,positive,allagree,1,2,1.0
Talentum 's net sales in September were smaller than expected .,negative,allagree,1,0,1.0
"Our customers come from the following countries : UK , USA , Spain , France , Italy , Germany , China , Hong Kong , Sweden , Norway , Netherlands , Austria , Belgium , Switzerland , Czech Republic , Finland , Canada , Russia , Ukraine , Denmark , Ireland , South Korea and Liechtenstein .",neutral,allagree,1,1,1.0
"Swedish , Finnish and Danish listed companies are organized in three market cap segments , Nordic Large Cap , Mid Cap and Small Cap .",neutral,allagree,1,1,1.0
The arrangements do not apply to the group 's units outside Finland .,neutral,allagree,1,1,1.0
1 February 2011 - Finnish textile and clothing company Marimekko Oyj HEL : MMO1V said today its preliminary operating profit grew to EUR8 .2 m in 2010 from EUR6 .3 m in 2009 .,positive,allagree,1,2,1.0
It is a disappointment to see the plan folded .,negative,75agree,2,0,0.7
"Finnish Ponsse has signed an agreement with Babcock Africa for the distribution and support of Ponsse forest machines , harvester heads , and information systems in South Africa .",positive,75agree,2,2,0.7
"The huge bridge girders will be delivered to the site from our plant in Ylivieska , Finland .",neutral,allagree,1,1,1.0
"The Finland-based company says it will move into an existing 260,000-square-foot facility in September .",neutral,75agree,2,1,0.7
"The acquisition does not have to be from the frozen foods or fish sector , as long as it has synergies with L+nnen Tehtaat 's other businesses .",neutral,allagree,1,1,1.0
"LONDON AFX - Shares in Rautaruukki Corp have been upgraded to ` hold ' from ` sell ' by ABN Amro , with the price target raised to 25.75 eur from 14.5 , said dealers .",positive,allagree,1,2,1.0
The deal also includes a ten-year maintenance agreement .,neutral,75agree,2,1,0.7
Active shipping is essential for Finland .,neutral,75agree,2,1,0.7
"`` Each year , personal entertainment plays a more significant role in determining whether a fitness facility 's workout experience is pleasurable or a chore , '' said Brian Wilson , director of marketing for Precor 's Entertainment & Services Division .",neutral,allagree,1,1,1.0
Changes to the as-built models from the design were communicated to the subcontractors to accommodate them into the steel and GRC glass reinforced concrete fabrication process .,neutral,allagree,1,1,1.0
It has been agreed with the company 's Board of Directors that she will be available in an advisory role .,neutral,75agree,2,1,0.7
"Sampo Bank 's market share of lending was 13.6 % , down from 14.4 % in the first quarter of 2008 .",negative,allagree,1,0,1.0
