text,label_str,source,priority,label,weight
"The Process Products orders are for the installation of separation-filtration equipment at three natural gas pipeline projects in China , South America , and Saudi Arabia .",neutral,75agree,2,1,0.7
ZAO YIT Moskovia builds housing in Moscow and its surrounding cities .,neutral,allagree,1,1,1.0
"In the Baltic countries , sales fell by 40.2 % , and in Russia , by 23.2 % in terms of euros , and by 10.7 % in terms of local currency .",negative,allagree,1,0,1.0
The production is to be liquidated before June 2009 and 325 employees loose their jobs .,negative,75agree,2,0,0.7
The company is presently examining whether the project would be financially feasible .,neutral,allagree,1,1,1.0
BioTie North-American licensing partner Somaxon Pharmaceuticals started a phase II-III clinical study in patients suffering from pathological gambling and a pilot phase II study in nicotine addiction smoking cessation .,neutral,allagree,1,1,1.0
"In Finland , snow storms brought trees down on power lines , cutting off electricity for some 2,000 households .",negative,75agree,2,0,0.7
"The sale will be finalized in September or October , the company said .",neutral,allagree,1,1,1.0
"In January , traffic , measured in revenue passenger kilometres RPK , went up by 3.2 % and capacity , measured in available seat kilometres ASK , rose by 12.2 % .",positive,allagree,1,2,1.0
Net profit in the same period in 2006 was (  x20ac ) 172 million .,neutral,75agree,2,1,0.7
Approval by shareholders of Cencorp in accordance with Finnish law .,neutral,75agree,2,1,0.7
The operating margin of Aker Yards Cruise & Ferries division went down from 8.3 % to 6.4 % in the first quarter of 2007 .,negative,allagree,1,0,1.0
"Elcoteq 's global service offering covers the entire lifecycle of products , from product development to after-market services .",neutral,75agree,2,1,0.7
"She will succeed Krister Kylas , who has decided to leave TeliaSonera .",neutral,allagree,1,1,1.0
Mr. Doring has been with Eaton since 1989 and acted as the Business Unit Manager for Eaton 's Power Controls Business Unit since January 2007 .,neutral,allagree,1,1,1.0
"Incap Contract Manufacturing Services Pvt Ltd , a subsidiary of Incap Corporation of Finland , plans to double its revenues by 2007-2008 .",positive,75agree,2,2,0.7
Orion 's net profit for the third quarter of 2007 decreased to 36.5 mln euro ( $ 52.1 mln ) from 40.3 mln euro ( $ 57.5 mln ) a year earlier .,negative,allagree,1,0,1.0
"Mr Ashley , deputy executive chairman of Sports Direct , sold a 43pc stake in the company for more than pounds 900m at the time of the float .",neutral,allagree,1,1,1.0
"Key shareholders of Finnish IT services provider TietoEnator Oyj on Friday rejected a hostile EUR1 .08 billion $ 1.67 billion offer from buyout shop Nordic Capital , giving new life to a possible counter offer from Blackstone Group LP and Norwegian telecom Telenor ASA .",positive,allagree,1,2,1.0
Another firm Air Liquide was exempted because it left the market in 1998 .,neutral,allagree,1,1,1.0
"The Division also includes joint sales , marketing and controlling functions for these units .",neutral,allagree,1,1,1.0
Connectivity Services include outsourced Scan and Capture which transfers paper invoices into electronic format and Basware Business Transactions Service enables the customer to receive and send invoices in an electronic format .,neutral,allagree,1,1,1.0
"The two companies will also partner in further developing Raiso 's cholesterol lowering brand , Benecol .",positive,75agree,2,2,0.7
"Net sales of Kyro 's main business area , Glaston Technologies , a manufacturer of glass processing machines , decreased to EUR 161.5 mn from EUR 164.1 mn in January-September 2005 .",negative,allagree,1,0,1.0
"( ADP News ) - Dec 11 , 2008 - Finnish construction and engineering company Outotec Oyj ( OMX : OTE1V ) said today it won a EUR 28 million ( USD 36.8 m ) order to expand the phosphate concentrator in Siilinjarvi of Norwegian minera",positive,allagree,1,2,1.0
"International sales rose by 59.8 % to EUR 1,244.4 mn .",positive,allagree,1,2,1.0
"Operating profit totaled EUR 9.4 mn , down from EUR 11.7 mn in 2004 .",negative,allagree,1,0,1.0
"The firm 's UK head office is in Rugby Road , Lutterworth .",neutral,allagree,1,1,1.0
"`` The Intel Atom processor has had tremendous success in the marketplace since its launch over 2 years ago , '' said Pankaj Kedia , director of global ecosystem programs for Intel Corp. 's Ultra Mobility Group .",positive,75agree,2,2,0.7
"This implementation is very important to the operator , since it is about to launch its Fixed-to-Mobile convergence service in Brazil see Brazil : 8 May 2006 : .",neutral,allagree,1,1,1.0
"The stock is trading above both its MAPs and the 50-day MAP of SEK72 .983 is higher than the 200-day MAP of SEK70 .283 , a bullish indicator .",positive,allagree,1,2,1.0
"The add-on order contains , among others , control valves and instrumentation as well as complete mill engineering and electrification with Metso drive controls .",neutral,allagree,1,1,1.0
"Body ES Vostok also owns stakes in power sales companies MosenergosbytBody ( RTS : MSSB ) ( 50.9 % ) , Altaienergosbyt ( 100 % ) , Saratovenergo ( RTS : SARE ) Body ( 48.36 % ) and Tambov Power Sales Company ( RTS : TASB ) ( 49.01 % ) , all ofBodywhich it received from the distribution balance .",neutral,75agree,2,1,0.7
"In the third quarter , net sales increased by 12 % year-on-year to EUR159 .5 m , or by 6 % at comparable currency rates growth .",positive,allagree,1,2,1.0
Otherwise the situation is under control .,neutral,allagree,1,1,1.0
"A In August 2007 , Latvijas Finieris ordered all production lines for a new green veneer mill to be built in Ukmerge , central Lithuania .",neutral,75agree,2,1,0.7
"Both operating profit and net sales for the 12-month period increased , respectively from EUR4 .7 m and EUR26 .7 m , as compared to 2004 .",positive,allagree,1,2,1.0
"Lead production , in turn , should increase to 60,000 tonnes through 2009 in what would be a twofold increase from current capacity levels , Zahariev said .",positive,75agree,2,2,0.7
"Commission income decreased to EUR 3.8 mn , compared to EUR 4.6 mn in the third quarter of 2007 .",negative,allagree,1,0,1.0
Operating profit for continuing operations fell to EUR 48.3 mn from EUR 72.4 mn in the first half of 2007 .,negative,allagree,1,0,1.0
"F-Secure Internet Security 2010 is a security service for surfing the web , online banking and shopping , e-mail , and other online activities .",neutral,allagree,1,1,1.0
The agreement includes the entire process of managing Mercator 's supply chain in all regions where the company is currently present .,neutral,allagree,1,1,1.0
"In the third quarter of 2010 , net sales increased by 5.2 % to EUR 205.5 mn , and operating profit by 34.9 % to EUR 23.5 mn .",positive,allagree,1,2,1.0
The amending of the proposal simplifies the proposed plan and increases the incentive for key employees to stay in the Company .,positive,75agree,2,2,0.7
"The contract incorporates a Convergent Charging rating solution for voice and data , which includes Internet , GPRS , SMS , MMS and WAP .",neutral,allagree,1,1,1.0
"Technopolis has set aside a plot of land measuring 4.6 hectares to build the park , Mikkonen said .",neutral,75agree,2,1,0.7
"The price of raw material aluminium went up at the end of 2005 , but the company considers its outlook for 2006 favourable .",positive,allagree,1,2,1.0
Vaisala 's net profit for the third quarter of 2007 dropped to 3.0 mln euro ( $ 4.3 mln ) from 6.8 mln euro ( $ 9.8 mln ) for the same period of 2006 .,negative,allagree,1,0,1.0
"The second variant offers complete final finishing of any selected apartment with foreign high quality materials ( Finland , Denmark , Germany , France ) .",neutral,allagree,1,1,1.0
At CapMan Haavisto will be responsible for Group Finances and Accounting and IT .,neutral,allagree,1,1,1.0
"Earnings per share ( EPS ) were EUR0 .03 , up from the loss of EUR0 .083 .",positive,allagree,1,2,1.0
"Operating result for the 12-month period decreased from the profit of EUR0 .4 m while turnover decreased from EUR5 .6 m , as compared to 2004 .",negative,allagree,1,0,1.0
"Nyrstar has also agreed to supply to Talvivaara up to 150,000 tonnes of sulphuric acid per annum for use in Talvivaara 's leaching process during the period of supply of the zinc in concentrate .",positive,75agree,2,2,0.7
"ALEXANDRIA , Va. , March 28 -- Pertti Salmi and Hanna Vuolteenaho , both of Oulu , Finland , and Sami Viitasaari of Ii , Finland , have developed an ornamental design for a handset , the U.S. Patent & Trademark Office announced .",neutral,75agree,2,1,0.7
"Operating loss totalled EUR 12.7 mn , compared to a profit of EUR 17.7 mn in the first half of 2008 .",negative,allagree,1,0,1.0
Net sales increased to EUR193 .3 m from EUR179 .9 m and pretax profit rose by 34.2 % to EUR43 .1 m. ( EUR1 = USD1 .4 ),positive,allagree,1,2,1.0
TeliaSonera said about $ 100 million will be invested in the next year in the region to bring mobile coverage to about 90 % of Nepal s population .,positive,75agree,2,2,0.7
The robust growth was the result of the inclusion of clothing chain Lindex in the Group in December 2007 .,positive,allagree,1,2,1.0
"After the split , the number of K shares will be 9 540 000 and the number of A shares 26 885 540 .",neutral,allagree,1,1,1.0
"Stockmann and Swedish sector company AB Lindex entered into an agreement on September 30 , 2007 , whereby Stockmann , or a wholly-owned subsidiary of it , will make a public tender offer for all of Lindex 's issued shares .",positive,75agree,2,2,0.7
"The flagship will open this fall in Manhattan 's Flatiron District in the `` Toy Building , '' at 200 Fifth Avenue .",neutral,allagree,1,1,1.0
"The total delivery volume of paper businesses in 2010 was 1,155,000 tonnes , up from 1,132,000 tonnes in 2009 .",positive,allagree,1,2,1.0
"Mika Stahlberg , VP F-Secure Labs , said , `` We are excited and proud that F-Secure has been recognized by AV-Comparatives as the Product of the Year .",positive,allagree,1,2,1.0
Exports grew 16.5 percent to 19.1 million liters .,positive,allagree,1,2,1.0
"Finnish drug distributor and wholesaler Oriola-KD Oyj said on October 11 , 2006 it named Anne Kariniemi vice president of its Logistics and Sourcing department as of January 15 , 2007 .",neutral,allagree,1,1,1.0
Pharmaceuticals - Netherlands This brand-new market analysis gives a clear overview of the actual situation and future outlook of the pharmaceutical market in Netherlands .,neutral,75agree,2,1,0.7
Finnish Vacon has signed significant deals with Norwegian Scandinavian Electric Systems ( SES ) on the supply of AC drives .,positive,allagree,1,2,1.0
"Loudeye Corp. , up $ 2.56 at $ 4.33 Nokia Corp. , down 10 cents at $ 19.46 Nokia agreed to buy the digital music distributor for $ 60 million .",neutral,75agree,2,1,0.7
Loss after taxes amounted to EUR 1.2 mn compared to a loss of 2.6 mn .,positive,75agree,2,2,0.7
"LKAB , headquartered in Lulea , Sweden , is a high-tech mining company producing upgraded iron ore products for the steel industry .",neutral,allagree,1,1,1.0
Rubin says he expects Capman to announce 1-2 additional transactions in 2009 .,neutral,allagree,1,1,1.0
"In Penttil+ 's vision , the most important reason for the transaction is Russia .",neutral,allagree,1,1,1.0
"The Finnish government announced Wednesday that it sold a 32 percent stake in chemicals and fertilizer group Kemira Oyj for (  x20ac ) 655.6 million ( $ 890US million ) , sending the company 's share price up 6 percent .",positive,allagree,1,2,1.0
The ship unloader is totally enclosed along the entire conveying line to the storage facilities .,neutral,allagree,1,1,1.0
"In Q1 of 2009 , the company 's operating loss totalled EUR 0.3 mn , compared to a profit of EUR 3.6 mn in Q1 of 2008 .",negative,allagree,1,0,1.0
"The contract consists of a new building with an area of 18,000 sq m and renovation of the existing buildings .",neutral,75agree,2,1,0.7
Rapala aims to move the distribution unit Ragot from Loudeac in Bretagne and the distribution unit Waterqueen and the fishing line supplier Tortue from Saint Marcel in Central France to Morvillars .,neutral,allagree,1,1,1.0
"Jon Risfelt has previously held operational executive positions in Europolitan , Ericsson , SAS , American Express card and travel divisions , as well as Nyman & Schultz ( CEO ) , Vodafone Sweden ( CEO ) , and Gambro Renal Products ( CEO ) .",neutral,allagree,1,1,1.0
"Pretax profit totalled EUR 2.0 mn , compared to a loss of EUR 159.2 mn in the fourth quarter of 2008 .",positive,allagree,1,2,1.0
Pharmaceuticals - Poland This brand-new market analysis gives a clear overview of the actual situation and future outlook of the pharmaceutical market in Poland .,neutral,75agree,2,1,0.7
Oriola-KD is a spin-off of Finnish pharmaceutical group Orion Oyj 's wholesale division .,neutral,allagree,1,1,1.0
Operating profit rose to EUR 3.2 mn from EUR 1.0 mn in the corresponding period in 2008 .,positive,allagree,1,2,1.0
"LONDON ( AFX ) - Intertek Group PLC , a testing and inspection company , said its commercial and electrical division has bought Finland-based company Natlabs Oy from Etteplan Oyj for 1.3 mln eur in cash .",neutral,75agree,2,1,0.7
"The company booked April-June new orders worth 949 mln eur , compared with 786 mln eur in the same period a year ago .",positive,75agree,2,2,0.7
"Ruukki has signed a contract to deliver and install the steel structures for a bridge over the Kyronsalmi strait in Savonlinna , Finland .",positive,75agree,2,2,0.7
"Finnish GeoSentric 's net sales decreased to EUR 939,000 in January-March 2009 .",negative,allagree,1,0,1.0
"CapMan said the deal 's effect on its cash flow for 2009 totals EUR3 .4 m , but the transaction would not affect its financial results for 2009 as it was executed at fair value .",neutral,allagree,1,1,1.0
21 December 2010 - Finnish industrial machinery company Wartsila Oyj Abp HEL : WRT1V said yesterday it had won an order to design a liquefied natural gas LNG powered platform supply vessel PSV for Norwegian oil service provider Eidesvik Offshore ASA OSL : EIOF .,positive,75agree,2,2,0.7
"The donations are granted to Aalto University and the universities of Helsinki , Tampere , Turku , Eastern Finland , Jyv+skyl+ , Oulu and Vaasa , and to polytechnics to be announced later .",neutral,allagree,1,1,1.0
"Like all other mechanical pipettors from Biohit , also Proline Plus is CE-IVD marked and comes with a 3-year warranty .",neutral,allagree,1,1,1.0
Finnish industrial group Ruukki Group Plc OMX Helsinki : RUG1V said on Friday 14 November that its furniture business segment Incap Furniture has concluded personnel negotiations that were started at the end of September .,neutral,75agree,2,1,0.7
"We succeeded in increasing our market share of sold apartment '' , comments Mr Kari Kauniskangas , Head of YIT International Construction Services .",positive,allagree,1,2,1.0
Finnish Bore that is owned by the Rettig family has grown recently through the acquisition of smaller shipping companies .,positive,allagree,1,2,1.0
"According to CEO Kai Telanne , the company 's newspapers achieved the best financial result ever .",positive,75agree,2,2,0.7
"Fiskars Brands report net sales of EUR 145.8 mn , up from EUR 138.4 mn .",positive,allagree,1,2,1.0
The total value of the contract is some EUR 8 million .,neutral,allagree,1,1,1.0
"The EU Commission said earlier it had fined ThyssenKrupp , United Technologies Corp 's Otis , Schindler AG and Kone Oyj a total of 992.3 mln eur for alleged cartel activity in the lift market going back twelve years .",negative,allagree,1,0,1.0
"The company had net sales of EUR 10.8 million in 2008 , and today has approximately 120 employees in Finland , Estonia and Poland .",neutral,allagree,1,1,1.0
You are warmly welcome !,neutral,75agree,2,1,0.7
"The pulp production in Finnish Kemij+rvi will also be liquidated and about 1,100 employees loose their jobs .",negative,75agree,2,0,0.7
"The business transfer will take effect from 1 January 2007 , and in connection with this 47 employees will transfer from Elisa to Daxtum as continuing employees .",neutral,allagree,1,1,1.0
"Progress Group , QPR 's representative in Saudi Arabia and North Africa , has signed a framework agreement for a long term strategic relationship with ISE .",positive,allagree,1,2,1.0
Nordic Walking was first used as a summer training method by cross-country skiers .,neutral,75agree,2,1,0.7
The continued operations mean the structure after the restructuring of the Aspocomp group including Aspocomp Oulu and the headquarter operations .,neutral,allagree,1,1,1.0
"Neste Oil said that while results from its biomass to 3 liquids demonstration plant , commissioned in June 2009 , have been promising , no decision on a commercial plant has been taken .",neutral,75agree,2,1,0.7
"Previously , the company anticipated its operating profit to improve over the same period .",positive,allagree,1,2,1.0
"Coca-Cola was the market leader of manufacturers with a market share of 36.9 % , down 2.2 % from the corresponding period in 2004-2005 .",negative,allagree,1,0,1.0
"Together with Latvia , Cramo will operate 54 rental outlets in the Baltic States .",neutral,allagree,1,1,1.0
Revenue grew 12 percent to (  x20ac ) 3.6 billion ( US$ 4.5 billion ) .,positive,allagree,1,2,1.0
"Finnish plumbing and heating systems supplier Uponor 's net sales in continuing business operations decreased to EUR 249.1 mn in July-September 2008 , compared to EUR 262.1 mn in the third quarter of 2007 .",negative,allagree,1,0,1.0
Teleste was set up in 1954 and is divided into Broadband Cable Networks and Video Networks business areas .,neutral,allagree,1,1,1.0
The potential acquirer is Cencorp Corporation which is a related entity to SAV owing to each of SAV and Cencorp being a subsidiary of the Finnish Savcor Group Oy .,neutral,75agree,2,1,0.7
"Mr Clausen , however , refused to comment the option that Nordea would consider buying into Citadele Bank .",neutral,75agree,2,1,0.7
"The company can be split into two parts over the coming months , with Essent owning and operating production and supply , and Enexis owning and operating the grid .",neutral,75agree,2,1,0.7
Nokia Siemens Networks has struggled to make a profit in the past two years .,negative,75agree,2,0,0.7
The lay-offs will affect 240 people out of the total 320 Okmetic employees in Finland .,negative,75agree,2,0,0.7
"The period 's sales dropped to EUR30 .6 m from EUR38 .3 m , according to the interim report , released today .",negative,allagree,1,0,1.0
"According to CEO Matti Perkonoja of the parent company HKScan , the company 's performance in the first quarter of 2010 has remained clearly below the level of the corresponding period in 2009 .",negative,allagree,1,0,1.0
"Following the registration , the share capital of Biotie is EUR 52,556,678.10 .",neutral,allagree,1,1,1.0
"In addition to the Tulikivi Corporation , he is also currently a member of the Board of the following companies : Altia Corporation , J+rvi-Suomen Portti Osuuskunta , Osuuskunta KPY , Profile Vehicles Oy and Voimatel Oy .",neutral,allagree,1,1,1.0
The value of the order is about EUR 30mn .,neutral,allagree,1,1,1.0
"The platen edges in contact with the band are provided with a seal having a protrusion directed towards the middle area of the platen , and means are provided to exert and maintain a pressure in the volume defined by the platen , the band and the seal . ''",neutral,allagree,1,1,1.0
That topped consensus forecasts for earnings of 0.21 euros a share .,positive,75agree,2,2,0.7
Ponsse projects the forest machine markets to improve more than expected in 2010 from the previous year .,positive,allagree,1,2,1.0
"HK Ruokatalo produces many turkey products , such as cold cuts .",neutral,allagree,1,1,1.0
"The 2500-passenger ferry will have dimensions of 185 m length overall , 170 m length between perpendiculars , 27.70 m breadth and 6.55 m design draught .",neutral,allagree,1,1,1.0
The acquisition is expected to improve access to chrome ore resources in Turkey .,positive,75agree,2,2,0.7
"According to the company , a decision in the issue will be made in the summer of 2010 , at the earliest , and in the summer of 2011 , at the latest .",neutral,allagree,1,1,1.0
"Global Markets Direct 's Pohjola Bank plc - Financial Analysis Review is an in-depth business , financial analysis of Pohjola Bank plc. .",neutral,75agree,2,1,0.7
The value of orders on hand totaled EUR 237.1 mn .,neutral,75agree,2,1,0.7
The total project duration is three years and it is valued at some EUR11 .5 m.,neutral,allagree,1,1,1.0
The shares carry a right to dividend and other shareholder rights as from their registration with the Finnish Trade Register .,neutral,75agree,2,1,0.7
He joined Rautakirja in 1997 to lead one of its four business areas and took up the position of President and CEO in 2001 .,neutral,allagree,1,1,1.0
"Sales in local currencies decreased by 0.5 percent while the number of subscribers rose by 12.7 million to a total of 147.6 million at the end of fourth quarter , the company said .",neutral,75agree,2,1,0.7
The Insolvency Act regulates the amount of debt that borrowers are permitted to write off .,neutral,allagree,1,1,1.0
Cameco typically prices sales contracts using a 40:60 ratio of fixed prices and spot prices .,neutral,allagree,1,1,1.0
Comptel Corporation will publish its financial statements for 2008 on 12 February 2009 .,neutral,allagree,1,1,1.0
"While I cant understand what theyre saying , its impressive to watch him hit that ball at those speeds .",neutral,75agree,2,1,0.7
"Clothing retail chain Sepp+l+ 's sales increased by 8 % to EUR 155.2 mn , and operating profit rose to EUR 31.1 mn from EUR 17.1 mn in 2004 .",positive,allagree,1,2,1.0
"In Finland , Alma Media will focus on quality and developing chain operations .",neutral,75agree,2,1,0.7
Finnish sports equipment maker Amer Sports Oyj ( HEL : AMEAS ) said today that its net loss narrowed to EUR 16.9 million ( USD 22.3 m ) in the second quarter of 2010 from EUR 23.2 million in the corresponding period a year earlier .,positive,75agree,2,2,0.7
Joint procurement will be later extended to the factories in the Baltic countries .,neutral,75agree,2,1,0.7
Demand was brisk as expected and order levels have remained high .,positive,75agree,2,2,0.7
It is expected to be online by 2011 .,neutral,allagree,1,1,1.0
The hack had been extra nefarious because the tweets activated without being clicked on - it was enough for Web surfers to move their mouse cursors over them .,negative,75agree,2,0,0.7
"Finnish shipping company Finnlines ' pretax loss totalled EUR 6.5 mn in the third quarter of 2009 , compared to a profit of EUR 0.3 mn in the third quarter of 2008 .",negative,allagree,1,0,1.0
"For 24-hour news , try ICIS news www.icis.com Click `` trial '' , then ICIS news",neutral,allagree,1,1,1.0
`` It allows the young child to move forward with his life . '',positive,75agree,2,2,0.7
"According to HK Ruokatalo , almost all the meat used by the company comes from Finland .",neutral,allagree,1,1,1.0
"Only this time , Nokia , India 's largest MNC , has sought out a topic that could spark off a million approaches ` Creativity in Emerging Markets .",neutral,75agree,2,1,0.7
"If needed , she provides also further information on ferry connections and hotels .",neutral,75agree,2,1,0.7
"Handelsbanken ranked before Local Cooperative Banks and Aktia in customer loyalty this time too , however .",positive,75agree,2,2,0.7
The options might include a partial or total divestment of their shareholdings in Ovako .,neutral,75agree,2,1,0.7
No planned closing date was provided .,neutral,allagree,1,1,1.0
"UPM said the move will lower net profit by  x20ac 385 million US$ 520 million in the second quarter , mainly due to impairment charges .",negative,75agree,2,0,0.7
Validating our fgVoIP client through Symbian Signed represents a significant step forward in accomplishing this goal .,positive,75agree,2,2,0.7
The new organization consists of two business units : Charging & Messaging and Finance & Administration .,neutral,allagree,1,1,1.0
"` Sanoma is a buyer not a target , ' he said .",neutral,allagree,1,1,1.0
A CUT ABOVE Bring the outdoors in with these birch-branch coasters .,neutral,75agree,2,1,0.7
The situation of coated magazine printing paper will continue to be weak .,negative,allagree,1,0,1.0
"As a result , it has started negotiations with the banks on provisional amendments concerning the covenants and other credit terms .",neutral,75agree,2,1,0.7
Pretax loss totaled EUR 117mn compared to a loss of EUR 65mn in the corresponding period .,negative,allagree,1,0,1.0
"Finnish electronics manufacturing services company Elcoteq signing a cooperation agreement with a Japanese mobile phone manufacturer , bypasses Elcoteq Tallinn , says Jan Kotka , CEO of Elcoteq Tallinn .",positive,75agree,2,2,0.7
The real estate company posted a net loss of +  x201a - 59.3 million +  x201a - 0.21 per share compared with a net profit of +  x201a - 31 million +  x201a - 0.11 per share for the corresponding quarter of 2007 .,negative,allagree,1,0,1.0
Finnish Bank of +land 's consolidated net operating profit increased from EUR 4.8 mn in the first quarter of 2005 to EUR 6.4 mn in the first quarter of 2006 .,positive,allagree,1,2,1.0
`` It wo n't happen overnight .,neutral,allagree,1,1,1.0
"The Australian company Mirabela Nickel has awarded Outokumpu Technology a contract for grinding technology for its nickel sulfide project in Bahia State , Brazil .",positive,allagree,1,2,1.0
"Kemira 's R&D organization comprises approximately 750 people , the company said .",neutral,allagree,1,1,1.0
The order is a follow-on to an 11 mln euro ( $ 16.1 mln ) deal made in July 2007 .,neutral,75agree,2,1,0.7
