text,label_str,source,priority,label,weight
"`` This contract demonstrates our ability to apply our minerals and metals technologies in adjacent industries , such as oil shale processing .",positive,75agree,2,2,0.7
"The commission found evidence of several meetings to discuss the cartel , including one in a Brussels restaurant in November 1997 at which the companies discussed price increases .",neutral,75agree,2,1,0.7
"The sale , comprising the margarine business in Finland and Poland , follows the approval of the Polish competition authorities earlier in October .",neutral,75agree,2,1,0.7
This is a much better process than using virgin paper as it requires less transportation of wood pulp from places like Finland and Canada .,positive,75agree,2,2,0.7
Altogether Finnair has canceled over 500 flights because of the strike .,negative,75agree,2,0,0.7
The deliveries started in April 2006 and will be completed in 2007 .,neutral,75agree,2,1,0.7
"The plant will be fired with a combination of spruce bark , chipped logging residues or milled peat .",neutral,75agree,2,1,0.7
Nordea Group 's operating profit increased in 2010 by 18 percent year-on-year to 3.64 billion euros and total revenue by 3 percent to 9.33 billion euros .,positive,allagree,1,2,1.0
"The unit 's clients are mainly in the field of specialist convenience goods , as well as in the textile , shoe and furniture businesses .",neutral,allagree,1,1,1.0
"Exports of goods fell by 59 % , and imports by 16.7 % .",negative,allagree,1,0,1.0
"`` Method and System for Controlling a Hard Disk Drive Using a Multimediacard Physical Interface '' was invented by Marko Ahvenainen Ruutana , Finland .",neutral,allagree,1,1,1.0
"Following the acquisitions , Panostaja will establish a new business unit which will focus on heat treatment of metals .",neutral,75agree,2,1,0.7
Sales of mid-strength beer decreased by 40 % .,negative,allagree,1,0,1.0
The diesel margin has remained high .,positive,75agree,2,2,0.7
18:30 Dinner The conference program can also be viewed as a live audio webcast through the internet pages at www.citycon.com .,neutral,allagree,1,1,1.0
"Again , the most significant sales increase of 18.6 % was in Russia .",positive,75agree,2,2,0.7
"Purchase it for the 12MP snapper , if nothing else .",neutral,allagree,1,1,1.0
"Turnover surged to EUR61 .8 m from EUR47 .6 m due to increasing service demand , especially in the third quarter , and the overall growth of its business .",positive,allagree,1,2,1.0
The company said shareholders will be able to vote on the agreement at an EGM scheduled for later this month .,neutral,75agree,2,1,0.7
"Net sales surged by 18.5 % to EUR167 .8 m. Teleste said that EUR20 .4 m , or 12.2 % , of the sales came from the acquisitions made in 2009 .",positive,allagree,1,2,1.0
Stora Enso will receive a 19.9 pct equity interest in the combined company .,neutral,allagree,1,1,1.0
Merrill Lynch analyst Campbell Morgan upgraded his recommendation on PaperlinX from `` neutral '' to `` buy '' in May .,positive,allagree,1,2,1.0
"ALEXANDRIA , Va. , May 23 -- Matti Harkonen and Pentti Sipponen , both of Espoo , Finland , Osmo Suovaniemi of Helsinki , Finland , and Tapani Tiusanen of Vantaa , Finland , have developed a paper web press device .",neutral,75agree,2,1,0.7
"Trading code : ELI1V Number of shares : 99,483 Price-share : Gratuitous After the transfer , Elisa holds a total of 10,435,023 own shares .",neutral,allagree,1,1,1.0
"Finnish pharmaceuticals company Orion reports profit before taxes of EUR 70.0 mn in the third quarter of 2010 , up from EUR 54.9 mn in the corresponding period in 2009 .",positive,allagree,1,2,1.0
Consumption is forecast to grow by about 2 % .,positive,75agree,2,2,0.7
Coffee will be served starting at 14:30 EET as well as after the event .,neutral,allagree,1,1,1.0
Finnish meat company Atria can no longer promise a sufficient amount of domestic beef to its customers .,negative,allagree,1,0,1.0
The contracts comprise turnkey orders for RoRo systems for two RoRo-cruise vessels under construction for Viking Line and Tallink .,neutral,75agree,2,1,0.7
"Aspo Plc STOCK EXCHANGE RELEASE February 11 , 2011 at8 .45 a.m. ESL Shipping Ltd , part of Aspo Group , has signed a new , long-term contract with Rautaruukki Corporation for the marine transport of raw materials on the Baltic Sea .",positive,75agree,2,2,0.7
"Frost sold shares for $ 19 million at $ 6.06-7 .12 per share , compared with Friday 's high of $ 11.33 and low of $ 10.14 .",negative,allagree,1,0,1.0
"According to ACNielsen 's ScanTrack study for the period week 10 of 2005 to week 9 of 2006 , Coca-Cola is the market leader in soft drinks in Finland .",positive,75agree,2,2,0.7
The report will be emailed within 2 business days of an order .,neutral,allagree,1,1,1.0
"Operating profit , excluding non-recurring items , totalled EUR 1.0 mn , down from EUR 1.6 mn .",negative,allagree,1,0,1.0
"Back then , Tikkurila 's former owner , Finnish chemicals company Kemira Oyj HEL : KRA1V , distributed an 86 % stake to Kemira shareholders to facilitate the divestment and listing of Tikkurila .",neutral,75agree,2,1,0.7
"Cardona slowed her vehicle , turned around and returned to the intersection , where she called 911 .",neutral,allagree,1,1,1.0
"Commission income increased by 22 % to EUR 4.4 mn , and lending volume rose by 13.5 % .",positive,allagree,1,2,1.0
The recent troubles simply make NETeller cheaper .,negative,75agree,2,0,0.7
"A. Le Coq Special was developed for the bicentenary of the company and the trade mark , the brewer said .",neutral,allagree,1,1,1.0
The fair value of the company 's investment properties went down to EUR 2.768 billion at the end of 2009 from EUR 2.916 billion a year earlier .,negative,allagree,1,0,1.0
"The contract also includes cutting and edging wagon parts at Ruukki 's steel service centres in Seinajoki and Raahe , both in southwestern Finland , from where they will be delivered to VR for welding and assembly .",neutral,allagree,1,1,1.0
"Finnish IT solutions provider Affecto Oyj HEL : AFE1V said today its slipped to a net loss of EUR 115,000 USD 152,000 in the second quarter of 2010 from a profit of EUR 845,000 in the corresponding period a year earlier .",negative,allagree,1,0,1.0
Other potential clients include public administration organizations investing in utility networks and services .,neutral,75agree,2,1,0.7
"According to Nordic financial group Nordea 's analyst Sami Sarkamies , this makes Nokia 's portfolio competitive again .",positive,allagree,1,2,1.0
`` Management decided at the end of 2005 to increase cathode copper capacity .,neutral,75agree,2,1,0.7
"EBITDA for the year 2009 improved to EUR484m , as compared with EUR472m in 2008 .",positive,allagree,1,2,1.0
hu will offer a further discount of between 25 % and 50 % on selected books .,neutral,75agree,2,1,0.7
South African Sappi will become the largest foreign forest industry company operating in Finland as a result of the acquisition Finnish M-real Corporation 's Graphic Papers Business unit .,positive,75agree,2,2,0.7
Mr. Koistinen joins from Nokia Siemens Networks where he has held various senior sales management and business development positions since 1997 .,neutral,allagree,1,1,1.0
"In January-September 2009 , the Group 's net interest income increased to EUR 112.4 mn from EUR 74.3 mn in January-September 2008 .",positive,allagree,1,2,1.0
The company expects its net sales in 2008 to increase 5-10 % from 2007 .,positive,allagree,1,2,1.0
"According to Honka Japan 's Managing Director Marko Saarelainen , Honkarakenne exports about 200 ready made log houses to Japan a year .",neutral,allagree,1,1,1.0
"The repayment of EUR 105 million debenture bonds is related to the Company 's previous announcement on October 21 , 2009 to collect irrevocable selling commitments from the holders of its subordinated debenture bonds .",neutral,75agree,2,1,0.7
"`` This is a significant milestone for Benefon , helping us to secure critical USP 's for our personal navigation product roadmap for 2007 and beyond , '' commented Simon Button , Chief Technology Officer at Benefon .",positive,allagree,1,2,1.0
"( ADP News ) - Oct 1 , 2008 - Finnish consulting and engineering company Poyry Oyj ( OMX : POY1V ) said today it was awarded a EUR 5.2 million ( USD 7.4 m ) extension to their existing consultancy engineering contract with Venezuel",positive,allagree,1,2,1.0
"Managing Director 's comments : `` Net sales for the first quarter were notably lower than a year before , especially in Finland , Russia and the Baltic countries .",negative,allagree,1,0,1.0
"The company recorded revenues of E658 .1 million during the fiscal year ended December 2007 , an increase of 23 % over 2006 .",positive,allagree,1,2,1.0
"The remainder of its revenues will come from technology agreements with other firms , InterDigital said .",neutral,allagree,1,1,1.0
"The 50-50 joint venture , to be called Nokia Siemens Networks , will be comprised of Nokia 's network business group and Siemens ' carrier-related operations , creating estimated synergies of 1.5 billion euros ( $ 1.9 billion ) by 2010 , Nokia said .",positive,75agree,2,2,0.7
The ongoing project where Tekla Structures is being used is the Vashi Exhibition Centre being developed by Insteel Engineers Pvt Ltd-IIVRCL Infrastructures & Projects Ltd & CIDCO .,neutral,allagree,1,1,1.0
"As with other stakeholders , COMPTEL has been involved in the workshops , meetings and filed comments on the issues of greatest importance to the competitive sector of our industry .",neutral,allagree,1,1,1.0
"In future , the plant will focus on the production of flange profiles for wind farm towers .",neutral,allagree,1,1,1.0
"Net sales in 2010 were about EUR 2.0 billion , of which international operations accounted for roughly a quarter .",neutral,75agree,2,1,0.7
This is the company 's first contract abroad .,neutral,75agree,2,1,0.7
Sales by Seppala diminished by 6 per cent .,negative,allagree,1,0,1.0
The share of the share capital of both above mentioned shareholders remains below 5 % .,neutral,allagree,1,1,1.0
"The Finnish national carrier said net loss in April through June was euro26 million , down from a net profit of euro13 million a year earlier .",negative,allagree,1,0,1.0
"The outsourced Scan and Capture solutions transfer paper invoices into electronic format , and Basware Business Transactions Service allows the customer to receive and send invoices in an electronic format .",neutral,75agree,2,1,0.7
"Olvi , which controls a 94 percent stake in Ragutis through A. Le Coq , said in its annual report published earlier this year that the Lithuanian brewery 's sales reached 15.04 million euros last year , a rise of 20.4 percent from 12.49 million euros in 2004 .",positive,allagree,1,2,1.0
Her present position is the director of Stockmann 's international department stores .,neutral,allagree,1,1,1.0
"Profit before taxes was EUR 4.0 mn , down from EUR 4.9 mn .",negative,allagree,1,0,1.0
The ISO certification demonstrates that we are moving forward in our quality commitments to our customers . ',positive,75agree,2,2,0.7
The total amount of subscription prices was recorded in the fund for invested non-restricted equity .,neutral,allagree,1,1,1.0
"Finnish construction company YIT is reducing the number of start-ups of market-financed residential units in 2007 to about 2,300 from the previously announced 2,700 .",negative,75agree,2,0,0.7
"These products include Personal Communications products such as mobile phones and their parts , Home Communications products such as set-top boxes and electronics for flat panel TVs as well as Communications Networks products such as base-stations , tower-top amplifiers , and microwave systems .",neutral,allagree,1,1,1.0
These moderate but significant changes resulted in a significant 24-32 % reduction in the estimated CVD risk .,positive,allagree,1,2,1.0
Aktia forecasts Finland 's inflation at 1.1 % in 2010 .,neutral,75agree,2,1,0.7
"Investments span across various product and investment types , including retail , hospitality , office , and residential , with interests in real-estate portfolios , non-performing loans and corporate restructurings .",neutral,75agree,2,1,0.7
The new shares entitle their holders to dividends for fiscal 2006 .,neutral,75agree,2,1,0.7
"F-Secure reported that : - The first half of 2008 has seen a growing number of targeted malware attacks on individuals , companies , and organizations .",neutral,75agree,2,1,0.7
The Bank is also examining the benefits of transferring the Swedish business to operate as a branch office so that the operations would be governed by Finland 's laws .,neutral,allagree,1,1,1.0
This resulted in improved sales figures in Sweden .,positive,allagree,1,2,1.0
"Sullivan said some of the boards `` really involve a lot of work , and people should get paid for their time . ''",neutral,allagree,1,1,1.0
Sponda Plc 's Annual General Meeting decided on 23 March 2005 to establish a Shareholders ' Nomination Committee to prepare proposals for the Annual General Meeting in 2006 on the composition of the Board of Directors and their remuneration .,neutral,75agree,2,1,0.7
Tekla Structures 16 is ` all about you and your team ' and compatible with the Windows 7 operating system .,neutral,75agree,2,1,0.7
Mr K.R. Vasantha has been appointed Managing Director of Incap Contract Manufacturing Services Pvt. Ltd. .,neutral,allagree,1,1,1.0
"The Group 's turnover in 2006 was EUR 39.2 million , and operating profit was EUR 3.9 million .",neutral,allagree,1,1,1.0
"To showcase our end-to-end capabilities at the Mobile World Congress , we arranged an internal MeeGo application development competition to entice developers to create new applications .",neutral,75agree,2,1,0.7
"Mr. Mikko Saavalainen , head of Comptel 's Global Sales concludes : `` Gibtelecom provides a perfect illustration of the variety of business , technical and regulatory challenges operators are facing in their OSS today .",neutral,allagree,1,1,1.0
"Operating profit totaled EUR 6.7 mn , down from EUR 7.2 mn in the corresponding period in 2005 .",negative,allagree,1,0,1.0
"Finnish software company QPR Software Plc ( OMX Helsinki : QPR1V ) reported on Thursday ( 23 October ) an operating profit of EUR63 ,000 on net sales of EUR1 .5 m for the third quarter 2008 .",neutral,75agree,2,1,0.7
"Savon koulutuskuntayhtyma , Finland based company has awarded contract for specialist agricultural or forestry machinery .",positive,allagree,1,2,1.0
Valga Lihatoostus markets its products under the Maks & Moorits trademark .,neutral,allagree,1,1,1.0
"Last year the company raised its turnover to approximately 7 million litas EUR 2 mln , from 6.1 million litas in 2004 .",positive,allagree,1,2,1.0
The new technology improves the glass quality and consistency while increasing throughput .,positive,75agree,2,2,0.7
Net sales in 2008 are expected to be on the same level as in 2007 .,neutral,75agree,2,1,0.7
"The market making in accordance with the agreement will begin on September 24 , 2009 .",neutral,allagree,1,1,1.0
"The new majority owners of Aspocomp Thailand Co. , Ltd are certain private persons belonging to immediate circle of Aspocomp 's present Joint Venture partner , Saha Pathana Inter-Holding Plc. .",neutral,allagree,1,1,1.0
"The share issue , derogating from the pre-emptive right of the shareholders and comprising some six million new shares at market price , will be offered for subscription by shareholders , holders of capital notes and by professional clients .",neutral,75agree,2,1,0.7
"No price was given for the transaction , which merges two London companies that have worked together on a number of projects including delivery of timetables for Britain 's National Express East Coast rail networks .",neutral,75agree,2,1,0.7
The previous offer was 3.4 % of voting rights and 12.3 % of capital .,neutral,allagree,1,1,1.0
"While the company did not indicate the level of investment in the unit , it said that has purchased the equipment of Nokia Corporation 's mobile phone R&D laboratory in Jyvaeskylae .",neutral,75agree,2,1,0.7
"The deal covers Stockmann Auto Oy Ab 's sales and after-sales services concerning Volkswagen and Audi in Helsinki , Espoo and Vantaa .",neutral,allagree,1,1,1.0
"Cargotec Corporation , Press Release , August 26 , 2008 at 10 a.m. Finnish time Cargotec 's MacGREGOR business area providing marine cargo handling and offshore load handling solutions has received significant offshore crane retrofit order .",positive,allagree,1,2,1.0
The sellers were the founders of the company .,neutral,allagree,1,1,1.0
Diluted earnings per share ( EPS ) rose to EUR 3.68 from EUR 0.50 .,positive,allagree,1,2,1.0
"In the end of 2006 , the number of outlets will rise to 60-70 .",positive,allagree,1,2,1.0
"In 2006 , 452 million tonnes CO2 of EUA ( EU Allowance ; emissions credit in EU ) was traded with an underlying market value approx .",neutral,allagree,1,1,1.0
"A total of 131000 Talvivaara Mining Company Plc 's new shares were subscribed for during the period between May 1 , 2010 and June 30 , 2010 under the company 's stock option rights 2007A .",neutral,75agree,2,1,0.7
"It holds 38 percent of Outokumpu 's shares and voting rights , but in 2001 lawmakers gave it permission to reduce the stake to 10 percent .",neutral,75agree,2,1,0.7
Sales in Finland rose by 3.9 % and international growth was 0.7 % .,positive,allagree,1,2,1.0
"By the end of 2006 , the number of joint branch offices will total 170 .",neutral,allagree,1,1,1.0
"Finnish telecoms software developer Tecnomen Oyj said on December 5 , 2006 it won a $ 3.3 mln ( 2.5 mln euro ) order to supply an expansion of the charging and messaging systems for the mobile and fixed networks of Brasil Telecom .",positive,allagree,1,2,1.0
"Because expenditures must be justified to pass budget approval hurdles , we believe our RoP model can help make it easier for IT and IT security practitioners to make the business case for acquiring enabling security technologies and related control activities .",neutral,75agree,2,1,0.7
"The Hayward , Calif.-based target designs active , casual and dress footwear , as well as boots and sandals .",neutral,allagree,1,1,1.0
M. and a Master of Business Administration MBA .,neutral,allagree,1,1,1.0
The measures taken will cause one-time costs during the final part of 2006 .,neutral,allagree,1,1,1.0
"BasWare Invoice Processing , BasWare Contract Matching , BasWare Order Matching and BasWare KPI Reporting Tool are part of the BasWare 's Enterprise Purchase to Pay solution suite .",neutral,75agree,2,1,0.7
Finnish KCI Konecranes has raised its net sales growth estimate for 2006 from over 25 % to over 35 % .,positive,allagree,1,2,1.0
The new chain has 700 discount stores and 250 supermarkets .,neutral,allagree,1,1,1.0
"The sellers include 40 shareholders , including Intellibis management , employees and other investors .",neutral,allagree,1,1,1.0
"Following the divestment , Fiskars 's Outdoor unit will comprise the brands Gerber , Silva and Buster , and will focus on multi-tools , knives , compasses , mobile lighting , pedometers , and aluminium boats .",neutral,75agree,2,1,0.7
The order includes 48 ship cranes that will be delivered for 12 container feeders to be built at Wenchong shipyard in China .,neutral,allagree,1,1,1.0
We offer our customers solutions based on renewable raw materials .,neutral,allagree,1,1,1.0
The plan is estimated to generate some EUR 5 million ( USD 6.5 m ) in cost savings on an annual basis .,positive,allagree,1,2,1.0
Sanoma News ' advertising sales decreased by 22 % during the year .,negative,allagree,1,0,1.0
"They are responsible for their own operations , customer relationships , and the development of these .",neutral,allagree,1,1,1.0
Tekla Group 's net sales for 2005 were approximately 38 million euros .,neutral,75agree,2,1,0.7
The value of the order is EUR 4mn .,neutral,allagree,1,1,1.0
Juha-Pekka Weckstr+m has been appointed President of telecom group TeliaSonera Finland to succeed Esa Rautalinko .,neutral,75agree,2,1,0.7
The objective of the St. Petersburg office is first to boost the Company 's maintenance business .,neutral,75agree,2,1,0.7
`` The new unit is a major investment in the Finnish media scene .,neutral,75agree,2,1,0.7
"The Stockmann department store will have a total floor space of over 8,000 square metres and Stockmann 's investment in the project will have a price tag of about EUR 12 million .",neutral,allagree,1,1,1.0
"For the first nine months of 2010 , Talvivaara 's net loss narrowed to EUR 8.3 million from EUR 21.9 million for the same period of 2009 .",positive,allagree,1,2,1.0
"Unit prices for straddle carriers vary between EUR700 ,000 and EUR900 ,000 , the company added .",neutral,allagree,1,1,1.0
"The company still expects its turnover in 2010 to slightly increase from the level of 2009 , adding that `` market predictability is still too poor for trustworthy forecasts on the market development of the contract manufacturing business during the current year '' .",positive,75agree,2,2,0.7
"On the route between Helsinki in Finland and Tallinn in Estonia , cargo volumes increased by 36 % , while cargo volumes between Finland and Sweden fell by 9 % .",neutral,75agree,2,1,0.7
We make available the following brand-new market analyses : Cement - UK Cement - Poland Cement - Belgium These analyses give a clear overview of the actual situation and future outlook of the cement industry in some European countries .,neutral,75agree,2,1,0.7
"According to Saarioinen 's Managing Director Ilkka M+kel+ , the food industry sector has a significant excess of production machinery .",neutral,75agree,2,1,0.7
"Operating profit excluding non-recurring items amounted to EUR 40.6 mn , down from EUR 57.3 mn year-on-year .",negative,allagree,1,0,1.0
"Operating profit totalled EUR 5.8 mn , up from a loss of EUR 1.7 mn in the fourth quarter of 2009 .",positive,allagree,1,2,1.0
"Net interest income was EUR 152.2 mn , up from EUR 101.0 mn in 2008 .",positive,allagree,1,2,1.0
"Shares in Royal and Sun Alliance continued to slide back from a 12-month high of 172p last month , after a potential suitor ruled itself out of a takeover bid .",negative,allagree,1,0,1.0
"Under the agreement Benefon 's forthcoming range of TWIG integrated GPS navigation and mobile phone devices will use the jointly developed web-based tracking and location technology , in both consumer and commercial applications .",neutral,75agree,2,1,0.7
Okmetic Board of Directors has also decided on a new share ownership program directed to the company 's top management .,neutral,allagree,1,1,1.0
This will bring cost savings of about EUR 3mn a year .,positive,allagree,1,2,1.0
"Okhta Center area is expected to have about 700,000 square metres of office premises by 2016 .",neutral,allagree,1,1,1.0
"Then , it said the contract was estimated to contribute more than EUR150m to its net sales in 2010 .",positive,75agree,2,2,0.7
HELSINKI AFX - KCI Konecranes said it has won an order for four hot metal ladle cranes from Indian steel producer Bhushan Steel and Strips Ltd. .,positive,allagree,1,2,1.0
"An  of the invention , released by the Patent Office , said : `` A non-coherent search matrix is formed of said correlation function matrix .",neutral,allagree,1,1,1.0
"According to Scanfil , demand for telecommunications network products has fluctuated significantly in the third quarter of 2006 , and the situation is expected to remain unstable for the rest of the year .",negative,75agree,2,0,0.7
UPM stock fell 3 percent to EURO 12.49 $ 17.24 in early afternoon trading in Helsinki .,negative,allagree,1,0,1.0
Finnish Aldata Solution has signed a contract of supply its G.O.L.D. system to two French retail chains .,positive,75agree,2,2,0.7
"Paper companies were in negative territories , with Stora Enso R shedding 1.62 pct to 12.73 eur , UPM-Kymmene down 0.80 pct at 18.64 eur and M-real B 0.18 pct lower at 5.57 eur .",negative,75agree,2,0,0.7
"Finnish Talentum reports its operating profit increased to EUR 20.5 mn in 2005 from EUR 9.3 mn in 2004 , and net sales totaled EUR 103.3 mn , up from EUR 96.4 mn .",positive,allagree,1,2,1.0
The first stage of the contract covers 133 stores and 600 cash registers .,neutral,allagree,1,1,1.0
The deal is subject to approval by the Norwegian competition authorities .,neutral,allagree,1,1,1.0
"This action follows personnel negotiations concerning Elcoteq SE , Finnish Branch , Elcoteq Finland Oy and Elcoteq Design Center Oy .",neutral,allagree,1,1,1.0
"Metsaliitto , however , narrowed its net loss for the second quarter of 2007 to 5.0 mln euro $ 6.9 mln from 61 mln euro $ 83.7 mln a year ago .",positive,allagree,1,2,1.0
"Nokia said it still expects to sell 150 more million Symbian devices in years to come , giving an indication of how it expects the Phone 7 handoff to work .",neutral,75agree,2,1,0.7
Solidium picked up Tikkurila shares as a dividend at a book value of EUR15 .80 per share .,neutral,75agree,2,1,0.7
The economic occupancy rate of Sponda 's property portfolio rose to 91.2 % from 88.8 % in 2006 .,positive,allagree,1,2,1.0
"Operating profit totalled EUR 21.1 mn , up from EUR 18.6 mn in 2007 , representing 9.7 % of net sales .",positive,allagree,1,2,1.0
"With the U.S. Federal Government putting a stake in the ground , vendors - and their customers - are focused on meeting the deadline .",neutral,allagree,1,1,1.0
"Operating profit for the 12-month period decreased from EUR157 .5 m , while net sales increased from EUR634 .3 m , as compared to 2007 .",negative,75agree,2,0,0.7
"Through the new production lines at the Novator mill in Veliky Ustjug , Vologda Oblast , Sveza will change its current 1.5 m by 1.5 m birch plywood production targeting the domestic market to produce 1.5 m by 3.0 m overlaid birch plywood for the global market .",neutral,75agree,2,1,0.7
